title,,,,cast,,,
Dick Johnson Is Dead,,,,,,,
My Little Pony: A New Generation,,,,"Vanessa Hudgens, Kimiko Glenn, James Marsden, Sofia Carson, Liza Koshy, Ken Jeong, Elizabeth Perkins, Jane Krakowski, Michael McKean, Phil LaMarr",,,
Sankofa,,,,"Kofi Ghanaba, Oyafunmike Ogunlano, Alexandra Duah, Nick Medley, Mutabaruka, Afemo Omilami, Reggie Carter, Mzuri",,,
The Starling,,,,"Melissa McCarthy, Chris O'Dowd, Kevin Kline, Timothy Olyphant, Daveed Diggs, Skyler Gisondo, Laura Harrier, Rosalind Chao, Kimberly Quinn, Loretta Devine, Ravi Kapoor",,,
Je Suis Karl,,,,"Luna Wedler, Jannis Niewöhner, Milan Peschel, Edin Hasanović, Anna Fialová, Marlon Boess, Victor Boccard, Fleur Geffrier, Aziz Dyab, Mélanie Fouché, Elizaveta Maximová",,,
Confessions of an Invisible Girl,,,,"Klara Castanho, Lucca Picon, Júlia Gomes, Marcus Bessa, Kiria Malheiros, Fernanda Concon, Gabriel Lima, Caio Cabral, Leonardo Cidade, Jade Cardozo",,,
Europe's Most Dangerous Man: Otto Skorzeny in Spain,,,,,,,
Intrusion,,,,"Freida Pinto, Logan Marshall-Green, Robert John Burke, Megan Elisabeth Kelly, Sarah Minnich, Hayes Hargrove, Mark Sivertsen, Brandon Fierro, Antonio Valles, Clint Obenchain",,,
Avvai Shanmughi,,,,"Kamal Hassan, Meena, Gemini Ganesan, Heera Rajgopal, Nassar, S.P. Balasubrahmanyam",,,
Go! Go! Cory Carson: Chrissy Takes the Wheel,,,,"Maisie Benson, Paul Killam, Kerry Gudjohnsen, AC Lim",,,
Jeans,,,,"Prashanth, Aishwarya Rai Bachchan, Sri Lakshmi, Nassar",,,
Minsara Kanavu,,,,"Arvind Swamy, Kajol, Prabhu Deva, Nassar, S.P. Balasubrahmanyam, Girish Karnad",,,
Grown Ups,,,,"Adam Sandler, Kevin James, Chris Rock, David Spade, Rob Schneider, Salma Hayek, Maria Bello, Maya Rudolph, Colin Quinn, Tim Meadows, Joyce Van Patten",,,
Dark Skies,,,,"Keri Russell, Josh Hamilton, J.K. Simmons, Dakota Goyo, Kadan Rockett, L.J. Benet, Rich Hutchman, Myndy Crist, Annie Thurman, Jake Brennan",,,
Paranoia,,,,"Liam Hemsworth, Gary Oldman, Amber Heard, Harrison Ford, Lucas Till, Embeth Davidtz, Julian McMahon, Josh Holloway, Richard Dreyfuss, Angela Sarafyan",,,
Ankahi Kahaniya,,,,"Abhishek Banerjee, Rinku Rajguru, Delzad Hiwale, Kunal Kapoor, Zoya Hussain, Nikhil Dwivedi, Palomi Ghosh",,,
The Father Who Moves Mountains,,,,"Adrian Titieni, Elena Purea, Judith State, Valeriu Andriuță, Tudor Smoleanu, Virgil Aioanei, Radu Botar, Petronela Grigorescu, Bogdan Nechifor, Cristian Bota",,,
The Stronghold,,,,"Gilles Lellouche, Karim Leklou, François Civil, Adèle Exarchopoulos, Kenza Fortas, Cyril Lecomte, Michaël Abiteboul, Idir Azougli, Vincent Darmuzey, Jean-Yves Berteloot",,,
Birth of the Dragon,,,,"Billy Magnussen, Ron Yuan, Qu Jingjing, Terry Chen, Vanness Wu, Jin Xing, Philip Ng, Xia Yu, Yu Xia",,,
Jaws,,,,"Roy Scheider, Robert Shaw, Richard Dreyfuss, Lorraine Gary, Murray Hamilton, Carl Gottlieb, Jeffrey Kramer, Susan Backlinie, Jonathan Filley, Ted Grossman",,,
Jaws 2,,,,"Roy Scheider, Lorraine Gary, Murray Hamilton, Joseph Mascolo, Jeffrey Kramer, Collin Wilcox Paxton, Ann Dusenberry, Mark Gruner, Barry Coe, Susan French",,,
Jaws 3,,,,"Dennis Quaid, Bess Armstrong, Simon MacCorkindale, Louis Gossett Jr., John Putch, Lea Thompson, P.H. Moriarty, Dan Blasko, Liz Morris, Lisa Maurer",,,
Jaws: The Revenge,,,,"Lorraine Gary, Lance Guest, Mario Van Peebles, Karen Young, Michael Caine, Judith Barsi, Mitchell Anderson, Lynn Whitfield",,,
My Heroes Were Cowboys,,,,,,,
Safe House,,,,"Denzel Washington, Ryan Reynolds, Vera Farmiga, Brendan Gleeson, Sam Shepard, Rubén Blades, Nora Arnezeder, Robert Patrick, Liam Cunningham, Joel Kinnaman",,,
Training Day,,,,"Denzel Washington, Ethan Hawke, Scott Glenn, Tom Berenger, Harris Yulin, Raymond J. Barry, Cliff Curtis, Dr. Dre, Snoop Dogg, Macy Gray, Eva Mendes",,,
InuYasha the Movie 2: The Castle Beyond the Looking Glass,,,,"Kappei Yamaguchi, Satsuki Yukino, Mieko Harada, Koji Tsujitani, Houko Kuwashima, Kumiko Watanabe, Noriko Hidaka, Kenichi Ogata, Toshiyuki Morikawa, Izumi Ogami",,,
InuYasha the Movie 3: Swords of an Honorable Ruler,,,,"Kappei Yamaguchi, Satsuki Yukino, Koji Tsujitani, Houko Kuwashima, Kumiko Watanabe, Ken Narita, Akio Otsuka, Kikuko Inoue",,,
InuYasha the Movie 4: Fire on the Mystic Island,,,,"Kappei Yamaguchi, Satsuki Yukino, Koji Tsujitani, Houko Kuwashima, Kumiko Watanabe, Noriko Hidaka, Ken Narita, Cho, Mamiko Noto, Nobutoshi Canna",,,
InuYasha the Movie: Affections Touching Across Time,,,,"Kappei Yamaguchi, Satsuki Yukino, Koji Tsujitani, Houko Kuwashima, Kumiko Watanabe, Kenichi Ogata, Noriko Hidaka, Hisako Kyoda, Ken Narita, Tomokazu Seki",,,
Naruto Shippuden the Movie: Blood Prison,,,,"Junko Takeuchi, Chie Nakamura, Rikiya Koyama, Kazuhiko Inoue, Masaki Terasoma, Mie Sonozaki, Yuichi Nakamura, Kengo Kawanishi, Kosei Hirota, Masako Katsuki",,,
Naruto Shippûden the Movie: Bonds,,,,"Junko Takeuchi, Chie Nakamura, Noriaki Sugiyama, Unsho Ishizuka, Motoko Kumai, Kazuhiko Inoue, Rikiya Koyama, Showtaro Morikubo, Nana Mizuki, Satoshi Hino, Shinji Kawada",,,
Naruto Shippûden the Movie: The Will of Fire,,,,"Junko Takeuchi, Chie Nakamura, Kazuhiko Inoue, Satoshi Hino, Showtaro Morikubo, Kentaro Ito, Ryoka Yuzuki, Kohsuke Toriumi, Nana Mizuki, Shinji Kawada, Yoichi Masukawa, Koichi Tochika, Yukari Tamura",,,
Naruto Shippuden: The Movie,,,,"Junko Takeuchi, Chie Nakamura, Yoichi Masukawa, Koichi Tochika, Ayumi Fujimura, Keisuke Oda, Daisuke Kishio, Fumiko Orikasa, Hidetoshi Nakamura, Tetsuya Kakihara, Kisho Taniyama, Miyuki Sawashiro, Katsuyuki Konishi, Masako Katsuki, Keiko Nemoto, Masashi Ebara, Kazuhiko Inoue, Showtaro Morikubo, Romi Park, Daisuke Ono, Seizo Kato",,,
Naruto Shippuden: The Movie: The Lost Tower,,,,"Junko Takeuchi, Chie Nakamura, Satoshi Hino, Rikiya Koyama, Nobuaki Fukuda, Kenji Hamada, Keiko Nemoto, Saori Hayami, Yumi Toma, Yuko Kobayashi, Fujiko Takimoto, Mutsumi Tamura, Mayuki Makiguchi, Toshiyuki Morikawa",,,
Naruto the Movie 2: Legend of the Stone of Gelel,,,,"Junko Takeuchi, Gamon Kaai, Chie Nakamura, Showtaro Morikubo, Akira Ishida, Yasuyuki Kase, Urara Takano, Sachiko Kojima, Houko Kuwashima, Takako Honda",,,
Naruto the Movie 3: Guardians of the Crescent Moon Kingdom,,,,"Junko Takeuchi, Chie Nakamura, Yoichi Masukawa, Kazuhiko Inoue, Akio Otsuka, Kyousuke Ikeda, Marika Hayashi, Umeji Sasaki, Masashi Sugawara, Hisao Egawa",,,
Naruto the Movie: Ninja Clash in the Land of Snow,,,,"Junko Takeuchi, Noriaki Sugiyama, Chie Nakamura, Kazuhiko Inoue, Yuhko Kaida, Tsutomu Isobe, Hirotaka Suzuoki, Jun Karasawa, Harii Kaneko, Ikuo Nishikawa",,,
Nightbooks,,,,"Winslow Fegley, Lidya Jewett, Krysten Ritter",,,
Schumacher,,,,Michael Schumacher,,,
A StoryBots Space Adventure,,,,"Evan Spiridellis, Erin Fitzgerald, Jeff Gill, Fred Tatasciore, Evan Michael Lee, Jared Isaacman, Sian Proctor, Chris Sembroski, Hayley Arceneaux",,,
King of Boys,,,,"Sola Sobowale, Adesua Etomi, Remilekun ""Reminisce"" Safaru, Tobechukwu ""iLLbliss"" Ejiofor, Toni Tones, Paul Sambo, Jide Kosoko, Sharon Ooja",,,
You vs. Wild: Out Cold,,,,"Bear Grylls, Jason Derek Prempeh",,,
Little Singham - Black Shadow,,,,"Sumriddhi Shukla, Jigna Bharadwaj, Sonal Kaushal, Neshma Chemburkar, Ganesh Divekar, Annamaya Verma, Anamay Verma, Manoj Pandey",,,
Tughlaq Durbar,,,,"Vijay Sethupathi, Parthiban, Raashi Khanna",,,
Tughlaq Durbar (Telugu),,,,"Vijay Sethupathi, Parthiban, Raashi Khanna",,,
Firedrake the Silver Dragon,,,,"Thomas Brodie-Sangster, Felicity Jones, Freddie Highmore, Patrick Stewart, Meera Syal, Sanjeev Bhaskar, Nonso Anozie",,,
Kate,,,,"Mary Elizabeth Winstead, Jun Kunimura, Woody Harrelson, Tadanobu Asano, Miyavi, Michiel Huisman, Miku Martineau",,,
Omo Ghetto: the Saga,,,,"Funke Akindele, Ayo Makun, Chioma Chukwuka Akpotha, Yemi Eberechi Alade, Blossom Chukwujekwu, Deyemi Okanlawon, Alexx Ekubo, Zubby Michael, Tina Mba, Femi Jacobs",,,
Prey,,,,"David Kross, Hanno Koffler, Maria Ehrich, Robert Finster, Yung Ngo, Klaus Steinbacher, Livia Matthes, Nellie Thalbach",,,
Blood Brothers: Malcolm X & Muhammad Ali,,,,"Malcolm X, Muhammad Ali",,,
Paradise Hills,,,,"Emma Roberts, Danielle Macdonald, Awkwafina, Eiza González, Milla Jovovich, Jeremy Irvine, Arnaud Valois, Daniel Horvath",,,
The Women and the Murderer,,,,,,,
JJ+E,,,,"Elsa Öhrn, Mustapha Aarab, Jonay Pineda Skallak, Magnus Krepper, Loreen, Albin Grenholm, Simon Mezher, Elsa Bergström Terent, Josef Kadim, Yohannes Frezgi",,,
Show Dogs,,,,"Will Arnett, Ludacris, Natasha Lyonne, Stanley Tucci, Jordin Sparks, Gabriel Iglesias, Shaquille O'Neal, Omar Chaparro, Alan Cumming, Andy Beckwith, Delia Sheppard, Kerry Shale",,,
If I Leave Here Tomorrow: A Film About Lynyrd Skynyrd,,,,"Ronnie Van Zandt, Gary Rossington, Allen Collins, Leon Wilkeson, Bob Burns, Billy Powell, Ed King, Artimus Pyle, Steve Gaines, Johnny Van Zant",,,
Untold: Breaking Point,,,,,,,
Shadow Parties,,,,"Jide Kosoko, Omotola Jalade-Ekeinde, Yemi Blaq, Sola Sobowale, Ken Erics, Toyin Aimakhu, Segun Arinze, Jibola Dabo, Rotimi Salami, Pa Jimi Solanke, Rachael Okonkwo, Bassey Okon, Lucien Morgan, Magdalena Korpas",,,
Angamaly Diaries,,,,"Antony Varghese, Reshma Rajan, Binny Rinky Benjamin, Vineeth Vishwam, Kichu Tellus, Sreekanth Dasan, Sarath Kumar, Tito Wilson, Anandhu, Bitto Davis, Sinoj Varghese",,,
A Champion Heart,,,,"Mandy Grace, David de Vos, Donna Rusch, Devan Key, Isabella Mancuso, Ariana Guido",,,
Worth,,,,"Michael Keaton, Stanley Tucci, Amy Ryan, Shunori Ramanathan, Ato Blankson-Wood, Tate Donovan, Laura Benanti, Chris Tardio",,,
Afterlife of the Party,,,,"Victoria Justice, Midori Francis, Robyn Scott, Adam Garcia, Timothy Renouf, Gloria Garcia, Myfanwy Waring, Spencer Sutherland",,,
Anjaam,,,,"Madhuri Dixit, Shah Rukh Khan, Tinnu Anand, Johny Lever, Kalpana Iyer, Himani Shivpuri, Sudha Chandran, Beena, Kiran Kumar",,,
Bright Star,,,,"Abbie Cornish, Ben Whishaw, Paul Schneider, Kerry Fox, Edie Martin, Thomas Brodie-Sangster, Claudie Blakley, Gerard Monaco, Antonia Campbell-Hughes, Samuel Roukin",,,
Dhanak,,,,"Krrish Chhabria, Hetal Gada, Vipin Sharma, Gulfam Khan, Suresh Menon, Vijay Maurya, Rajiv Lakshman, Ninad Kamat",,,
Final Account,,,,,,,
Gurgaon,,,,"Akshay Oberoi, Pankaj Tripathi, Ragini Khanna, Aamir Bashir, Shalini Vatsa, Ashish Verma",,,
Here and There,,,,"Janine Gutierrez, JC Santos, Victor Anastacio, Yesh Burce, Lotlot De Leon",,,
In the Cut,,,,"Meg Ryan, Mark Ruffalo, Jennifer Jason Leigh, Nick Damici, Sharrieff Pugh, Kevin Bacon, Yaani King Mondschein, Heather Litteer",,,
Shikara,,,,"Aadil Khan, Sadia Khateeb, Zain Khan Durrani, Priyanshu Chatterjee, Bhavna Chauhan, Ashwin Dhar, Farid Azad Khan, Saghar Sehrai",,,
A Cinderella Story,,,,"Hilary Duff, Chad Michael Murray, Jennifer Coolidge, Dan Byrd, Regina King, Julie Gonzalo, Lin Shaye, Madeline Zima, Andrea Avery, Mary Pat Gleason, Paul Rodriguez, Whip Hubley, Kevin Kilner, Erica Hubbard, Simon Helberg",,,
Agatha Christie's Crooked House,,,,"Glenn Close, Terence Stamp, Max Irons, Gillian Anderson, Christina Hendricks, Stefanie Martini, Julian Sands, Honor Kneafsey, Christian McKay, Amanda Abbington",,,
An Unfinished Life,,,,"Robert Redford, Jennifer Lopez, Morgan Freeman, Josh Lucas, Damian Lewis, Camryn Manheim, Becca Gardner, Lynda Boyd, Rob Hayter, P. Lynn Johnson",,,
Barbie Big City Big Dreams,,,,"America Young, Amber May, Giselle Fernandez, Alejandro Saab, Dinora Walcott",,,
Blade Runner: The Final Cut,,,,"Harrison Ford, Rutger Hauer, Sean Young, Edward James Olmos, M. Emmet Walsh, Daryl Hannah, William Sanderson, Brion James, Joe Turkel, Joanna Cassidy, James Hong, Morgan Paull",,,
Chappie,,,,"Sharlto Copley, Hugh Jackman, Sigourney Weaver, Dev Patel, Ninja, Yo-Landi Visser, Jose Pablo Cantillo, Brandon Auret, Johnny Selema, Maurice Carpede",,,
Clear and Present Danger,,,,"Harrison Ford, Willem Dafoe, Anne Archer, Joaquim de Almeida, Henry Czerny, Harris Yulin, Donald Moffat, Miguel Sandoval, Benjamin Bratt, Dean Jones, Thora Birch, James Earl Jones, Raymond Cruz",,,
Cliffhanger,,,,"Sylvester Stallone, John Lithgow, Michael Rooker, Janine Turner, Rex Linn, Caroline Goodall, Leon, Craig Fairbrass, Ralph Waite, Max Perlich, Paul Winfield",,,
Cold Mountain,,,,"Jude Law, Nicole Kidman, Renée Zellweger, Eileen Atkins, Brendan Gleeson, Philip Seymour Hoffman, Natalie Portman, Giovanni Ribisi, Donald Sutherland, Ray Winstone",,,
Crocodile Dundee in Los Angeles,,,,"Paul Hogan, Linda Kozlowski, Jere Burns, Jonathan Banks, Aida Turturro, Alec Wilson, Gerry Skilton, Steve Rackman, Serge Cockburn, Paul Rodriguez, Mark Adair-Rios, Tiriel Mora, Grant Piro, Mike Tyson",,,
Dear John,,,,"Channing Tatum, Amanda Seyfried, Richard Jenkins, Henry Thomas, D.J. Cotrona, Cullen Moss, Gavin McCulley, Jose Lucena Jr., Keith Robinson, Scott Porter",,,
Do the Right Thing,,,,"Danny Aiello, Ossie Davis, Ruby Dee, Richard Edson, Giancarlo Esposito, Spike Lee, Bill Nunn, John Turturro, Paul Benjamin, Frankie Faison, Samuel L. Jackson, Rosie Perez, Martin Lawrence, Miguel Sandoval",,,
"El patrón, radiografía de un crimen",,,,"Joaquín Furriel, Luis Ziembrowski, Guillermo Pfening, Mónica Lairana, Germán de Silva, Victoria Raposo, Andrea Garrote",,,
Extraction,,,,"Bruce Willis, Kellan Lutz, Gina Carano, D.B. Sweeney, Joshua Mikel, Steve Coulter, Dan Bilzerian, Heather Johansen",,,
Freedom Writers,,,,"Hilary Swank, Patrick Dempsey, Scott Glenn, Imelda Staunton, April L. Hernandez, Mario, Kristin Herrera, Jaclyn Ngan, Sergio Montalvo, Jason Finn, Deance Wyatt, Vanetta Smith",,,
Green Lantern,,,,"Ryan Reynolds, Blake Lively, Peter Sarsgaard, Mark Strong, Tim Robbins, Jay O. Sanders, Taika Waititi, Angela Bassett",,,
House Party,,,,"Christopher Reid, Christopher Martin, Robin Harris, Tisha Campbell, A.J. Johnson, Martin Lawrence, Paul Anthony, Bowlegged Lou, B-Fine, Edith Fields, Kelly Jo Minter, Clifton Powell, Verda Bridges",,,
House Party 2,,,,"Christopher Reid, Christopher Martin, Martin Lawrence, Bowlegged Lou, Paul Anthony, B-Fine, Tisha Campbell, Kamron, Iman, Queen Latifah",,,
House Party 3,,,,"Christopher Reid, Christopher Martin, Tisha Campbell, David Edwards, Angela Means, Ketty Lester, Bernie Mac, Michael Colyar, Chris Tucker, Khandi Alexander",,,
I Got the Hook Up,,,,"Master P, Anthony Johnson, Gretchen Palmer, Frantz Turner, Richard Keats, Joe Estevez, William Knight, Anthony Boswell, Tommy 'Tiny' Lister, Helen Martin, John Witherspoon, Mia X",,,
In Too Deep,,,,"Omar Epps, LL Cool J, Nia Long, Stanley Tucci, Pam Grier, Hill Harper, Jake Weber, David Patrick Kelly, Veronica Webb, Ron Canada, Robert LaSardo, Gano Grills, Ivonne Coll, Don Harvey, Mya, Nasir 'Nas' Jones, Jermaine Dupri",,,
Initial D,,,,"Jay Chou, Anne Suzuki, Edison Chen, Anthony Wong Chau-sang, Shawn Yue, Chapman To, Jordan Chan, Kenny Bee",,,
Janoskians: Untold and Untrue,,,,"Jai Brooks, Luke Brooks, James Yammouni, Daniel Sahyounie, Beau Brooks",,,
Labyrinth,,,,"David Bowie, Jennifer Connelly, Frank Oz, Kevin Clash, Anthony Asbury, Dave Goelz, Brian Henson, Ron Mueck, Karen Prell, Shari Weiser",,,
Letters to Juliet,,,,"Amanda Seyfried, Christopher Egan, Gael García Bernal, Vanessa Redgrave, Franco Nero, Luisa Ranieri, Marina Massironi, Milena Vukotic, Marcia DeBonis, Luisa De Santis, Lidia Biondi, Giordano Formenti, Chris Egan",,,
Level 16,,,,"Katie Douglas, Celina Martin, Peter Outerbridge, Sara Canning, Alexis Whelan, Amalia Williamson, Josette Halpert, Kiana Madeira",,,
Love Don't Cost a Thing,,,,"Nick Cannon, Christina Milian, Kenan Thompson, Kal Penn, Steve Harvey, Al Thompson, Ashley Monique Clark, Elimu Nelson, Nichole Robinson, Melissa Schuman",,,
Love in a Puff,,,,"Miriam Chin Wah Yeung, Shawn Yue, Singh Hartihan Bitto, Isabel Chan, Cheung Tat-ming, Matt Chow, Chui Tien-you, Queenie Chu, Charmaine Fong, Vincent Kok",,,
Mars Attacks!,,,,"Jack Nicholson, Glenn Close, Annette Bening, Pierce Brosnan, Danny DeVito, Martin Short, Sarah Jessica Parker, Michael J. Fox, Rod Steiger, Tom Jones, Lukas Haas, Natalie Portman",,,
Marshall,,,,"Chadwick Boseman, Josh Gad, Kate Hudson, Sterling K. Brown, Dan Stevens, James Cromwell, Keesha Sharp, Roger Guenveur Smith, Derrick Baskin, Barrett Doss",,,
My Boss's Daughter,,,,"Ashton Kutcher, Tara Reid, Jeffrey Tambor, Andy Richter, Michael Madsen, Jon Abrahams, David Koechner, Carmen Electra, Kenan Thompson, Terence Stamp, Molly Shannon",,,
Mystery Men,,,,"Ben Stiller, Hank Azaria, William H. Macy, Janeane Garofalo, Kel Mitchell, Paul Reubens, Wes Studi, Greg Kinnear, Geoffrey Rush, Lena Olin, Eddie Izzard, Artie Lange, Pras, Claire Forlani, Tom Waits",,,
Once Upon a Time in America,,,,"Robert De Niro, James Woods, Elizabeth McGovern, Treat Williams, Tuesday Weld, Burt Young, Joe Pesci, Danny Aiello, William Forsythe, James Hayden",,,
Open Season 2,,,,"Joel McHale, Mike Epps, Jane Krakowski, Billy Connolly, Crispin Glover, Steve Schirripa, Georgia Engel, Diedrich Bader, Cody Cameron, Fred Stoller, Olivia Hack",,,
Osmosis Jones,,,,"Chris Rock, Laurence Fishburne, David Hyde Pierce, Brandy Norwood, William Shatner, Ron Howard, Kid Rock, Ben Stein",,,
Poseidon,,,,"Josh Lucas, Kurt Russell, Jacinda Barrett, Richard Dreyfuss, Emmy Rossum, Mía Maestro, Mike Vogel, Kevin Dillon, Freddy Rodríguez",,,
Rhyme & Reason,,,,"Too $hort, B-Real, Kurtis Blow, Da Brat, Grandmaster Caz, Sean ""P. Diddy"" Combs, Chuck D., Desiree Densiti, Dr. Dre, E-40, MC Eiht, Heavy D, Lauryn Hill, Ice-T, Wyclef Jean, Ras Kass, KRS-One, L.V., Mack 10, Craig Mack, Method Man, Keith Murray, Nasir 'Nas' Jones, The Notorious B.I.G., Master P, Q-Tip, Raekwon, Redman, Senen Reyes, Busta Rhymes, RZA, DJ Scratch, Erick Sermon, Tupac Shakur, Adario Strange, Suave",,,
Same Kind of Different as Me,,,,"Greg Kinnear, Renée Zellweger, Djimon Hounsou, Jon Voight, Olivia Holt",,,
School of Rock,,,,"Jack Black, Joan Cusack, Mike White, Sarah Silverman, Lee Wilkof, Kate McGregor-Stewart, Adam Pascal, Suzzanne Douglas, Miranda Cosgrove, Kevin Alexander Clark, Joey Gaydos Jr., Robert Tsai, Veronica Afflerbach, Jordan-Claire Green",,,
Snervous Tyler Oakley,,,,Tyler Oakley,,,
Tears of the Sun,,,,"Bruce Willis, Monica Bellucci, Cole Hauser, Eamonn Walker, Johnny Messner, Nick Chinlund, Charles Ingram, Paul Francis, Chad Smith, Tom Skerritt, Malick Bowens, Awaovieyi Agie",,,
The Blue Lagoon,,,,"Brooke Shields, Christopher Atkins, Leo McKern, William Daniels, Elva Josephson, Glenn Kohan, Alan Hopgood, Gus Mercurio",,,
The Golden Child,,,,"Eddie Murphy, J.L. Reate, Charles Dance, Charlotte Lewis, Victor Wong, Randall Tex Cobb, James Hong, Shakti Chen, Tau Logo, Tiger Chung Lee",,,
The Guns of Navarone,,,,"Gregory Peck, David Niven, Anthony Quinn, Stanley Baker, Anthony Quayle, James Darren, Irene Papas, Gia Scala, James Robertson Justice, Richard Harris",,,
The Interview,,,,"James Franco, Seth Rogen, Lizzy Caplan, Randall Park, Diana Bang, Timothy Simons, Reese Alexander, James Yi",,,
The Nutty Professor,,,,"Eddie Murphy, Jada Pinkett Smith, James Coburn, Larry Miller, Dave Chappelle, John Ales, Patricia Wilson, Jamal Mixon",,,
The Nutty Professor II: The Klumps,,,,"Eddie Murphy, Janet Jackson, Larry Miller, John Ales, Richard Gant, Anna Maria Horsford, Melinda McGraw, Jamal Mixon, Gabriel Williams, Chris Elliott",,,
Welcome Home Roscoe Jenkins,,,,"Martin Lawrence, James Earl Jones, Joy Bryant, Margaret Avery, Mike Epps, Mo'Nique, Cedric the Entertainer, Nicole Ari Parker, Michael Clarke Duncan, Louis C.K.",,,
In the Line of Fire,,,,"Clint Eastwood, John Malkovich, Rene Russo, Dylan McDermott, Gary Cole, Fred Thompson, John Mahoney, Gregory Alan Williams, Jim Curley, Sally Hughes",,,
Untold: Crime & Penalties,,,,,,,
2 Alone in Paris,,,,"Ramzy Bedia, Éric Judor, Benoît Magimel, Kristin Scott Thomas, Élodie Bouchez, Édouard Baer, Fred Testot, Omar Sy",,,
Thimmarusu,,,,"Satya Dev, Priyanka Jawalkar, Brahmaji",,,
Wind River,,,,"Jeremy Renner, Elizabeth Olsen, Jon Bernthal, Gil Birmingham, Kelsey Asbille, Tantoo Cardinal, Teo Briones, Matthew Del Negro, Hugh Dillon, Julia Jones, James Jordan, Eric Lange, Martin Sensmeier, Mason Davis, Graham Greene",,,
C Kkompany,,,,"Mithun Chakraborty, Tusshar Kapoor, Anupam Kher, Rajpal Yadav, Raima Sen, Dilip Prabhavalkar, Sanjay Mishra",,,
EMI: Liya Hai To Chukana Padega,,,,"Sanjay Dutt, Arjun Rampal, Malaika Arora, Aashish Chaudhary, Neha Uberoi, Urmila Matondkar, Manoj Joshi, Daya Shankar Pandey, Pushkar Jog, Kulbhushan Kharbanda",,,
He's All That,,,,"Addison Rae, Tanner Buchanan, Rachael Leigh Cook, Madison Pettis, Isabella Crovetti, Matthew Lillard, Peyton Meyer, Annie Jacob, Myra Molloy, Kourtney Kardashian",,,
Koi Aap Sa,,,,"Aftab Shivdasani, Natassha, Dipannita Sharma, Himanshu Mallik, Vaidya Advai, Pushy Anand, Shama Deshpande, Rajendra Gupta",,,
Krishna Cottage,,,,"Sohail Khan, Isha Koppikar, Natassha, Rati Agnihotri, Vrajesh Hirjee, Divya Palat, Hiten Tejwani, Rajendranath Zutshi",,,
Kucch To Hai,,,,"Tusshar Kapoor, Esha Deol, Natassha, Vrajesh Hirjee, Kusumit Sana, Rishi Kapoor, Moon Moon Sen, Johny Lever, Ashay Chitre, Jeetendra",,,
Kyaa Kool Hai Hum,,,,"Tusshar Kapoor, Riteish Deshmukh, Isha Koppikar, Neha Dhupia, Anupam Kher, Jay Sean",,,
Kyaa Kool Hain Hum 3,,,,"Tusshar Kapoor, Aftab Shivdasani, Krishna Abhishek, Mandana Karimi, Shakti Kapoor, Darshan Jariwala, Sushmita Mukherjee, Meghna Naidu, Anand Kumar, Claudia Ciesla",,,
Kyaa Super Kool Hain Hum,,,,"Tusshar Kapoor, Riteish Deshmukh, Anupam Kher, Rohit Shetty, Neha Sharma, Chunky Pandey, Sarah-Jane Dias, Razak Khan, Kavin Dave",,,
Kyo Kii... Main Jhuth Nahin Bolta,,,,"Govinda, Sushmita Sen, Rambha, Anupam Kher, Satish Kaushik, Sharad Kapoor, Kiran Kumar, Mohnish Bahl",,,
"LSD: Love, Sex Aur Dhokha",,,,"Nushrat Bharucha, Anshuman Jha, Neha Chauhan, Rajkummar Rao, Arya Banerjee, Amit Sial, Herry Tangri",,,
Mission Istaanbul: Darr Ke Aagey Jeet Hai,,,,"Vivek Oberoi, Zayed Khan, Shriya Saran, Nikitin Dheer, Shabbir Ahluwalia, Sunil Shetty, Shweta Bhardwaj",,,
Once Upon a Time in Mumbaai,,,,"Ajay Devgn, Emraan Hashmi, Kangana Ranaut, Prachi Desai, Randeep Hooda, Naved Aslam, Asif Basra, Avtar Gill",,,
Once Upon a Time in Mumbai Dobaara!,,,,"Akshay Kumar, Imran Khan, Sonakshi Sinha, Sonali Bendre, Sarfaraz Khan, Mahesh Manjrekar, Abhimanyu Singh, Kurush Deboo, Pitobash, Chetan Hansraj",,,
Ragini MMS,,,,"Kainaz Motivala, Rajkummar Rao, Rajat Kaul, Janice, Shernaza, Mangala Ahire, Vinod Rawat",,,
Ragini MMS 2,,,,"Sunny Leone, Saahil Prem, Parvin Dabas, Sandhya Mridul, Divya Dutta, Soniya Mehra, Kainaz Motivala, Karan Mehra",,,
SAS: Rise of the Black Swan,,,,"Sam Heughan, Ruby Rose, Andy Serkis, Hannah John-Kamen, Tom Wilkinson, Tom Hopper, Noel Clarke, Anne Reid, Owain Yeoman, Jing Lusi, Ray Panthaki, Richard McCabe, Douglas Reith",,,
Shootout at Lokhandwala,,,,"Amitabh Bachchan, Sanjay Dutt, Sunil Shetty, Arbaaz Khan, Abhishek Bachchan, Vivek Oberoi, Tusshar Kapoor, Rohit Roy, Shabbir Ahluwalia, Dia Mirza, Amrita Singh, Neha Dhupia",,,
Shor In the City,,,,"Sendhil Ramamurthy, Tusshar Kapoor, Nikhil Dwivedi, Preeti Desai, Sundeep Kishan, Radhika Apte, Pitobash, Girija Oak, Alok Chaturvedi, Sudhir Chowdhary",,,
The Dirty Picture,,,,"Vidya Balan, Emraan Hashmi, Tusshar Kapoor, Naseeruddin Shah, Rajesh Sharma, Imran Hasnee, Anju Mahendru",,,
"Bob Ross: Happy Accidents, Betrayal & Greed",,,,Bob Ross,,,
Really Love,,,,"Kofi Siriboe, Yootha Wong-Loi-Sing, Michael Ealy, Uzo Aduba",,,
The November Man,,,,"Pierce Brosnan, Luke Bracey, Olga Kurylenko, Eliza Taylor, Caterina Scorsone, Bill Smitrovich, Will Patton, Amila Terzimehic, Lazar Ristovski, Mediha Musliovic",,,
The Old Ways,,,,"Brigitte Kali Canales, Andrea Cortes, Julia Vera, Sal Lopez",,,
The River Runner,,,,,,,
The Water Man,,,,"David Oyelowo, Rosario Dawson, Lonnie Chavis, Amiah Miller, Alfred Molina, Maria Bello",,,
Count Me In,,,,,,,
Untold: Caitlyn Jenner,,,,,,,
Boomika,,,,"Aishwarya Rajesh, Vidhu, Surya Ganapathy, Madhuri, Pavel Navageethan, Avantika Vandanapu",,,
Boomika (Hindi),,,,"Aishwarya Rajesh, Vidhu, Surya Ganapathy, Madhuri, Pavel Navageethan, Avantika Vandanapu",,,
Boomika (Malayalam),,,,"Aishwarya Rajesh, Vidhu, Surya Ganapathy, Madhuri, Pavel Navageethan, Avantika Vandanapu",,,
Boomika (Telugu),,,,"Aishwarya Rajesh, Vidhu, Surya Ganapathy, Madhuri, Pavel Navageethan, Avantika Vandanapu",,,
The Witcher: Nightmare of the Wolf,,,,"Theo James, Mary McDonnell, Lara Pulver, Graham McTavish, Tom Canton, David Errigo Jr, Jennifer Hale, Kari Wahlgren, Matt Yang King, Darryl Kurylo, Keith Ferguson",,,
Gunshot,,,,"Ahmed El Fishawy, Ruby, Mohamed Mamdouh, Ahmed Malek, Asmaa Abulyazeid, Samy Maghawry, Safaa El-Toukhy, Ahmed Kamal, Arfa Abdel Rassoul, Hana Shiha",,,
Man in Love,,,,"Roy Chiu, Ann Hsu, Tsai Chen-nan, Chung Hsin-ling, Lan Wei-hua, Peace Yang, Huang Lu Tz-yin",,,
Sweet Girl,,,,"Jason Momoa, Isabela Merced, Manuel Garcia-Rulfo, Amy Brenneman, Adria Arjona, Raza Jaffrey, Justin Bartha, Lex Scott Davis, Michael Raymond-James",,,
The Loud House Movie,,,,"Asher Bishop, David Tennant, Michelle Gomez, Jill Talley, Brian Stepanek, Catherine Taber, Liliana Mumy, Nika Futterman, Cristina Pucelli, Jessica DiCicco, Grey Griffin, Lara Jill Miller",,,
A Faraway Land,,,,"Paolo Contis, Yen Santos, Hans Tórgarð, Ruby Ruiz, Zweden Obias, Maria Rianne Castro, Arianne Mavis Uera, Maricor Canlas",,,
Like Crazy,,,,"Anton Yelchin, Felicity Jones, Jennifer Lawrence, Charlie Bewley, Alex Kingston, Oliver Muirhead, Finola Hughes, Chris Messina, Ben York Jones, Jamie Thomas King",,,
Black Island,,,,"Philip Froissant, Alice Dwyer, Hanns Zischler, Mercedes Müller, Sammy Scheuritzel, Lieselotte Voß, Katharina Schütz, Jodie Leslie Ahlborn, Marco Wittorf, Ilknur Boyraz",,,
Bombay,,,,"Arvind Swamy, Manisha Koirala, Nasser, Raja Krishnamoorthy",,,
Memories of a Murderer: The Nilsen Tapes,,,,,,,
