title,,,,cast,,,
Class of '83,,,,"Bobby Deol, Bhupendra Jadawat, Hitesh Bhojraj, Anup Soni, Joy Sengupta, Sameer Paranjape, Ninad Mahajani, Prithvik Pratap",,,
Dark Forces,,,,"Tenoch Huerta, Eréndira Ibarra, Dale Carley, Ariane Pellicer, Johana Blendl, Dai Liparoti, Mauricio Aspe, Nick Zedd",,,
The Sleepover,,,,"Sadie Stanley, Maxwell Simkins, Ken Marino, Malin Akerman, Cree Cicchino, Lucas Jaye, Karla Souza, Enuka Okuma, Erik Griffin, Joe Manganiello",,,
John Was Trying to Contact Aliens,,,,,,,
Scarecrow,,,,"Ahmed Helmy, Menna Shalaby, Khaled El Sawy, Bayoumi Fouad, Entsar, Samy Maghawry, Mahmoud Ellisy, Yasser El Tobgy, Hassan Hosny, Lotfy Labib",,,
The Crimes That Bind,,,,"Cecilia Roth, Miguel Ángel Solá, Benjamín Amadeo, Sofía Gala Castiglione, Yanina Ávila, Marcelo Subiotto, Paola Barrientos, Diego Cremonesi, Claudio Martínez Bel",,,
Little Singham: Kaal Ka Badla,,,,"Anamaya Verma, Arushi Talwar, Ganesh Divekar, Jigna Bhardwaj, Krishna Dasadiya, Neshma Chemburkar, Manoj Pandey, Parminder Ghumman, Pranav Vaidya, Saumya Daan, Sonal Kaushal, Sumriddhi Shukla",,,
Drunk Parents,,,,"Alec Baldwin, Salma Hayek, Jim Gaffigan, Joe Manganiello, Treat Williams, Ben Platt, Aasif Mandvi, Natalia Cigliuti",,,
Meet the In-Laws,,,,"Adeniyi Johnson, Tina Mba, Dele Odule, Lilian Esoro, Amaechi Muonagor, Blessing Onwukwe, Dayo Amusa, Kenneth Okolie",,,
Crazy Awesome Teachers,,,,"Gading Marten, Dian Sastrowardoyo, Faradina Mufti, Boris Bokir, Kevin Ardilova, Shakira Jasmine, Asri Welas, Arswendi Bening Swara, Kiki Narendra, Ibnu Jamil",,,
Islands of Faith,,,,,,,
Les Misérables,,,,"Hugh Jackman, Russell Crowe, Anne Hathaway, Amanda Seyfried, Sacha Baron Cohen, Helena Bonham Carter, Eddie Redmayne, Aaron Tveit, Samantha Barks, Daniel Huttlestone",,,
Seventh Son,,,,"Jeff Bridges, Ben Barnes, Julianne Moore, Alicia Vikander, Antje Traue, Olivia Williams, John DeSantis, Kit Harington, Djimon Hounsou, Gerard Plunkett, Jason Scott Lee",,,
What's Your Raashee?,,,,"Harman Baweja, Priyanka Chopra, Manju Singh, Anjan Srivastav, Darshan Jariwala, Dilip Joshi, Vishwa Badola, Rajesh Vivek, Daya Shankar Pandey, Yuri Suri",,,
Beyond the Boundary: ICC Women's T20 World Cup Australia 2020,,,,,,,
Fearless,,,,"Yara Shahidi, Miles Robbins, Miguel J. Pimentel, Gabrielle Union, Jadakiss, Tom Kenny, Angie Martinez, Harland Williams, Fat Joe, Amari McCoy, Dwyane Wade",,,
Nigerian Prince,,,,"Antonio Bell, Chinaza Uche, Tina Mba, Bimbo Manuel, Toyin Oshinaike, Craig Stott, Ebbe Bassey, Cristabel Goddy, Omar Maskati, Russell G. Jones, Dean Cameron",,,
Octonauts & the Caves of Sac Actun,,,,"Teresa Gallagher, Simon Greenall, Keith Wickham, Rob Rackstraw, Michael Murphy, Jo Wyatt, Helen Walsh, Andres Williams, Paul Panting",,,
Project Power,,,,"Jamie Foxx, Joseph Gordon-Levitt, Dominique Fishback, Rodrigo Santoro, Courtney B. Vance, Amy Landecker, Machine Gun Kelly, Tait Fletcher, Allen Maldonado, Andrene Ward-Hammond",,,
An Easy Girl,,,,"Mina Farid, Zahia Dehar, Benoît Magimel, Nuno Lopes, Clotilde Courau, Loubna Abidar, ""Riley"" Lakdhar Dridi, Henri-Noël Tabary",,,
Christine,,,,"Rebecca Hall, Michael C. Hall, Tracy Letts, Maria Dizzia, J. Smith-Cameron, Timothy Simons, Kim Shaw, John Cullum, Morgan Spector, Jayson Warner Smith",,,
Simon Killer,,,,"Brady Corbet, Mati Diop, Constance Rousseau, Lila Salet, Solo, Michaël Abiteboul, Nicolas Ronchi, Étienne Rotha Moeng",,,
Gunjan Saxena: The Kargil Girl,,,,"Janhvi Kapoor, Pankaj Tripathi, Angad Bedi, Viineet Kumar, Manav Vij, Ayesha Raza Mishra",,,
Mr. Peabody & Sherman,,,,"Ty Burrell, Max Charles, Ariel Winter, Stephen Colbert, Leslie Mann, Stanley Tucci, Allison Janney, Mel Brooks, Patrick Warburton, Stephen Tobolowsky, Lake Bell",,,
"Rob Schneider: Asian Momma, Mexican Kids",,,,Rob Schneider,,,
The Lost Husband,,,,"Leslie Bibb, Josh Duhamel, Nora Dunn, Sharon Lawrence, Callie Hope Haverda, Roxton Garcia",,,
Diamonds in the Sky,,,,"Joke Silva, Omowunmi Dada, Bimbo Akintola, Femi Adebayo, Kayode Olaiya, Ali Nuhu, Yvonne Jegede, Toyin Abraham, Adebayo Salami, Ayo Mogaji, Magaji Mijinyawa",,,
We Summon the Darkness,,,,"Alexandra Daddario, Amy Forsyth, Keean Johnson, Maddie Hasson, Logan Miller, Austin Swift, Johnny Knoxville, Allison McAtee, Tanner Beard",,,
"Berlin, Berlin: Lolle on the Run",,,,"Felicitas Woll, Janina Uhse, Jan Sosniok, Matthias Klimsa, Sandra Borgmann, Kai Lentrodt, Armin Rohde, Gitta Schweighöfer, Kailas Mahadevan",,,
Stars in the Sky: A Hunting Story,,,,Steven Rinella,,,
The Magic School Bus Rides Again Kids In Space,,,,"Kate McKinnon, Matthew Mucci, Mikaela Blake, Gabby Clarke, Roman Lutterotti, Leke Maceda-Rustecki, Birva Pandya, Lynsey Pham, Kaden Stephen",,,
Work It,,,,"Sabrina Carpenter, Jordan Fisher, Liza Koshy, Keiynan Lonsdale, Michelle Buteau, Drew Ray Tanner",,,
Nasha Natasha,,,,Natalia Oreiro,,,
Anelka: Misunderstood,,,,Nicolas Anelka,,,
Sin City,,,,"Yvonne Nelson, Kunle Remi, Adjetey Anang, Oscar Provencal, Michelle McKinney Hammond, Rosaline Meurer, Kweku Elliot, Regina Van Helvert, Alhaji Fadika, Isaac Akwesi Awonor",,,
A Go! Go! Cory Carson Summer Camp,,,,"Alan C. Lim, Smith Foreman, Abigail Vibat, Pfifer Chastain, Jim Capobianco, Neena-Sinaii Simpo, Eli Morse, Adelaide Hirasaki, Paul Killam, Kerry Gudjohnsen, Maisie Benson",,,
Malibu Rescue: The Next Wave,,,,"Ricardo Hurtado, Breanna Yde, Jackie R. Jacobson, Abby Donnelly, Alkoya Brunson, Jeff Meacham, Ella Gross, Carlos Sanson, JT Neal, Camaron Engels, Kirrilee Berger",,,
Sam Jay: 3 In The Morning,,,,Sam Jay,,,
Almost Love,,,,"Scott Evans, Augustus Prew, Kate Walsh, Michelle Buteau, Zoë Chao, Patricia Clarkson, Colin Donnell, Christopher Gray",,,
Killing Hasselhoff,,,,"Ken Jeong, David Hasselhoff, Jim Jefferies, Jon Lovitz, Rhys Darby, Dan Bakkedahl, Jennifer Ikeda, Will Sasso, Colton Dunn",,,
Rogue Warfare: The Hunt,,,,"Will Yun Lee, Jermaine Love, Rory Markham, Bertrand-Xavier Corbi, Katie Keene, Fernando Chien, Gina DeCesare, Michael Blalock, Chris Mulkey, Stephen Lang",,,
Super Monsters: The New Class,,,,"Elyse Maloway, Vincent Tong, Erin Mathews, Andrea Libman, Alessandro Juliani, Nicole Anthony, Diana Kaarina, Gigi Saul Guerrero, Asia Mattu, Rukiya Bernard, Elicia MacKenzie, Ian James Corlett, Britt McKillip",,,
The Ottoman Lieutenant,,,,"Michiel Huisman, Hera Hilmar, Josh Hartnett, Ben Kingsley, Haluk Bilginer, Affif Ben Badra, Paul Barrett, Jessica Turner",,,
Tumi or not Tumi,,,,Tumi Morake,,,
What Keeps You Alive,,,,"Hannah Emily Anderson, Brittany Allen, Martha MacIsaac, Joey Klein, Charlotte Lindsay Marron",,,
Latte and the Magic Waterstone,,,,"Ashley Bornancin, Carter Hastings",,,
Raat Akeli Hai,,,,"Nawazuddin Siddiqui, Radhika Apte, Khalid Tyabji, Aditya Srivastava, Padmavati Rao, Shivani Raghuvanshi, Nishant Dahiya, Shweta Tripathi, Gyanendra Tripathi, Shreedhar Dubey, Swanand Kirkire, Riya Shukla, Tigmanshu Dhulia, Ila Arun, Natasha Rastogi",,,
Seriously Single,,,,"Fulu Mugovhani, Tumi Morake, Bohang Moeko, Yonda Thomas",,,
Sugar High,,,,Hunter March,,,
Retablo,,,,"Junior Béjar Roca, Amiel Cayo, Magaly Solier, Hermelinda Luján, Mauro Chuchón, Claudia Solís, Coco Chiarella",,,
Uma Maheswara Ugra Roopasya,,,,"Satya Dev, VK Naresh, Raghavan, Suhas P, Ravindra Vijay, Chandana Koppisetti, Roopa Koduvayur, Kushalini Pulapa",,,
It's Her Day,,,,"Bovi Ugboma, Amanda Ebeye, Shaffy Bello, Adunni Ade, Ini Dima-Okojie, 'Najite Dede, Gregory Ojefua, Thelma Ezeamaka, Femi Durojaiye, Ese Lami George, Toni Tones",,,
Redemption,,,,"Gil Alexandre, Arlete Bombe, Rashid Abdul, Laquino Fonseca, Tomas Bie, Candido Quembo, Jorge Amade, Aldovina Chiziane",,,
Shine Your Eyes,,,,"O.C. Ukeje, Indira Nascimento, Paulo André, Ike Barry, Chukwudi Iwuji",,,
The Hater,,,,"Maciej Musiałowski, Agata Kulesza, Danuta Stenka, Vanessa Aleksander, Maciej Stuhr, Jacek Koman, Adam Gradowski, Piotr Biedron, Martynika Kosnica",,,
The Speed Cubers,,,,,,,
Tread,,,,,,,
Banana Split,,,,"Hannah Marks, Liana Liberato, Dylan Sprouse, Luke Spencer Roberts, Jessica Hecht, Addison Riecke, Meagan Kimberly Smith, Haley Ramm",,,
Door Ke Darshan,,,,"Dolly Ahluwalia, Manu Rishi Chadha, Mahie Gill, Shardul Rana, Archita Sharma, Rajesh Sharma, Supriya Shukla, Mehak Manwani",,,
Double World,,,,"Henry Lau, Peter Ho, Lin Chenhan, Jiang Luxia, Ming Hu, Him Law, Shi Shi, Mark Cheng, Wang Ziyi, Xu Minghu",,,
Project Marathwada,,,,"Om Puri, Seema Biswas, Kunal Sheth, Rahul Patel, Katarina Kajkus, Farrah Kader, Govind Namdeo, Dalip Tahil",,,
Animal Crackers,,,,"Emily Blunt, John Krasinski, Ian McKellen, Danny DeVito, Raven-Symoné, Patrick Warburton, Wallace Shawn, Gilbert Gottfried, Tara Strong, Harvey Fierstein, James Arnold Taylor, Kevin Grevioux, Sylvester Stallone, Lydia Rose Taylor",,,
Dragons: Rescue Riders: Secrets of the Songwing,,,,"Noah Kaye Bentley, Brennley Brown, Zach Callison, Nicolas Cantu, Skai Jackson, Marsai Martin, Andre Robinson, Carlos Alazraqui, Renée Elise Goldsberry",,,
Nimbe,,,,"Odunlade Adekola, Chimezie Imo, Sani Danja, Rachael Okonkwo, Broda Shaggi, Toyin Abraham, Kelechi Udegbe, Doyin Abiola, Molawa Davis",,,
Offering to the Storm,,,,"Marta Etura, Leonardo Sbaraglia, Carlos Librado ""Nene"", Francesc Orella, Imanol Arias, Álvaro Cervantes, Itziar Aizpuru, Benn Northover, Marta Larralde, Alicia Sánchez, Eduardo Rosa, Angel Alkain, Ana Wagener, Paco Tous, Patricia López Arnaiz, Pedro Casablanc",,,
Romance Doll,,,,"Issey Takahashi, Yuu Aoi, Kenta Hamano, Toko Miura, Koji Ohkura, Pierre Taki, Eri Watanabe, Kitaro",,,
The Kissing Booth 2,,,,"Joey King, Joel Courtney, Jacob Elordi, Molly Ringwald, Taylor Zakhar Perez, Maisie Richardson-Sellers, Meganne Young",,,
The Larva Island Movie,,,,"Hong Bum-ki, Eddy Lee, Kang Shi-hyun, Ahn Hyo-min, Kim Yeon-woo, Choi Nak-yoon, Tom Wayland, Erica Schroeder",,,
The Letter Reader,,,,"Bahle Mashinini, Nomalanga Shabane, Andile Gumbi, Nokuthula Mazibuko",,,
The Remix: Hip Hop X Fashion,,,,,,,
Ip Man 4: The Finale,,,,"Donnie Yen, Wu Yue, Vanness Wu, Scott Adkins, Kent Cheng, Danny Chan Kwok-kwan, Kanin Ngo, Chris Collins, Vanda Margraf, Meng Lo",,,
Jack Whitehall: I'm Only Joking,,,,Jack Whitehall,,,
Funan,,,,"Bérénice Bejo, Louis Garrel, Colette Kieffer, Aude-Laurence Clermont Biver, Brice Montagne, Franck Sasonoff, Hervé Sogne, Maxime Baudoin, Tom Trouffier, Lila Lacombe, Céline Ronté, Emilie Marié, Thierry Jahn",,,
Father Soldier Son,,,,,,,
The Millions,,,,"Ramsey Nouah, Blossom Chukwujekwu, Ayo Makun, Nancy Isime, Ali Nuhu, Folusho Durojaiye, Toyin Abraham, Chika Lann, Broda Shaggi, Etinosa Idemudia",,,
Fatal Affair,,,,"Nia Long, Omar Epps, Stephen Bishop, Maya Stojan, Aubrey Cleland, Carolyn Hennesy",,,
MILF,,,,"Virginie Ledoyen, Marie-Josée Croze, Axelle Laffont, Matthias Dandois, Victor Meutelet, Waël Sersoub, Florence Thomassin",,,
Cold Feet,,,,"Jim Iyke, Joselyn Dumas, Enyinna Nwigwe, Beverly Naya, Femi Adebayo, Segun Arinze, Padita Agu",,,
Little Singham: Legend of Dugabakka,,,,,,,
Sylvia,,,,"Chris Attoh, Zainab Balogun, Ini Dima-Okojie, Udoka Onyeka, Lord Frank, Bolaji Ogunmola, Ijeoma Grace Agu, Omotunde Adebowale David",,,
The Players,,,,"Valerio Mastandrea, Riccardo Scamarcio, Laura Chiatti, Valentina Cervi, Marina Foïs, Euridice Axen, Massimiliano Gallo, Alessia Giuliani",,,
Urzila Carlson: Overqualified Loser,,,,Urzila Carlson,,,
We Are One,,,,,,,
Hole in the Wall,,,,"André Odendaal, Nicholas Campbell, Tinarie van Wyk Loots, Bheki Mkwane, Susan Coetzer, Botho Molohloane, Anna Davel, Nomboniso Paile, Dania Gelderblom, Hamish Kyd",,,
Mama's Boy,,,,"Hesham Maged, Shikoo, Mohammed Tharwat, Mahmoud Ellisy, Ahmed Sultan, Noor Kadri",,,
The Claudia Kishi Club,,,,,,,
The Old Guard,,,,"Charlize Theron, KiKi Layne, Marwan Kenzari, Luca Marinelli, Harry Melling, Van Veronica Ngo, Matthias Schoenaerts, Chiwetel Ejiofor",,,
Your Excellency,,,,"Akin Lewis, Funke Akindele, Kemi Lala Akindoju, Shaffy Bello, Kunle Coker, Eku Edewor, Alexx Ekubo, Osas Ighodaro Ajibade, Seyi Law, Falz, Chigul, Deyemi Okanlawon, Beverly Osu, Toni Tones, Christian Paul, Bimbo Manuel, Helen Paul",,,
Born Racer,,,,Scott Dixon,,,
Mucho Mucho Amor: The Legend of Walter Mercado,,,,Walter Mercado,,,
The Long Dumb Road,,,,"Tony Revolori, Jason Mantzoukas, Taissa Farmiga, Grace Gummer, Ciara Bravo, Casey Wilson, Pamela Reed, Ron Livingston",,,
Dr. Seuss' The Lorax,,,,"Danny DeVito, Ed Helms, Taylor Swift, Zac Efron, Betty White, Rob Riggle, Jenny Slate, Nasim Pedrad, Joel Swetow, Michael Beattie, Stephen Tobolowsky",,,
Jim Jefferies: Intolerant,,,,Jim Jefferies,,,
A Kid from Coney Island,,,,Stephon Marbury,,,
PNL - Dans la légende tour,,,,PNL,,,
Aiyyaa,,,,"Rani Mukerji, Prithviraj Sukumaran, Nirmiti Sawant, Subodh Bhave, Jyoti Subhash, Satish Alekar, Anita Date, Amey Wagh, Kishori Balal, Pakoda Pandi",,,
Bbuddah Hoga Terra Baap,,,,"Amitabh Bachchan, Hema Malini, Raveena Tandon, Sonu Sood, Sonal Chauhan, Charmy Kaur, Prakash Raj, Makrand Deshpande, Subbaraju, Shawar Ali, Rajeev Verma",,,
Blood Money,,,,"Manish Chaudhary, Kunal Kemmu, Amrita Puri, Shekar Shukla, Teeshay, Mia Evonne Uyeda",,,
Bombay Talkies,,,,"Rani Mukerji, Randeep Hooda, Saqib Saleem, Nawazuddin Siddiqui, Sadashiv Amrapurkar, Amitabh Bachchan, Ranvir Shorey, Katrina Kaif, Diana Penty",,,
Boss,,,,"Akshay Kumar, Ronit Roy, Shiv Pandit, Mithun Chakraborty, Johny Lever, Aditi Rao Hydari, Danny Denzongpa, Govind Namdeo, Parikshat Sahni, Aakash Dabhade",,,
Budhia Singh: Born to Run,,,,"Manoj Bajpayee, Mayur Mahendra Patole, Tillotama Shome, Shruti Marathe, Chhaya Kadam, Gajraj Rao",,,
Chashme Baddoor,,,,"Rishi Kapoor, Ali Zafar, Taapsee Pannu, Siddharth, Divyendu Sharma, Anupam Kher, Bharati Achrekar, Lillete Dubey, Ayaz Khan",,,
Dharam Sankat Mein,,,,"Paresh Rawal, Annu Kapoor, Alka Badola Kaushal, Auritra Ghosh, Naseeruddin Shah, Manoj Raghubir Sharma, Rushita Pandya, Murli Sharma",,,
Drishyam,,,,"Ajay Devgn, Shriya Saran, Tabu, Rajat Kapoor, Ishita Dutta, Mrunal Jadhav, Prasanna Ketkar, Yogesh Sonam, Prathamesh Parab, Rishabh Chaddha",,,
Gabbar Is Back,,,,"Akshay Kumar, Shruti Haasan, Sunil Grover, Kareena Kapoor, Ishita Vyas, Suman Talwar, Jaideep Ahlawat, Shruti Bapna",,,
Gollu Aur Pappu,,,,"Vir Das, Sandeepa Dhar, Dimple Kapadia, Kunaal Roy Kapur, Deepak Tijori",,,
Inkaar,,,,"Arjun Rampal, Chitrangada Singh, Deepti Naval, Kanwaljeet Singh, Rehana Sultan, Vipin Sharma, Kaizaad Kotwal, Sujata Sehgal, Shivani Tanksale, Asheesh Kapur",,,
Madras Café,,,,"John Abraham, Nargis Fakhri, Rashi Khanna, Avijit Dutt, Prakash Belawadi, Ajay Ratnam, Siddartha Basu, Agnello Dias, Dibang",,,
Mary Kom,,,,"Priyanka Chopra, Darshan Kumar, Sunil Thapa, Kenny Basumatary, Shishir Sharma, Robin Das, Rajni Basumatary, Lin Laishram, Shakti Singh",,,
Michael,,,,"Naseeruddin Shah, Mahie Gill, Sabyasachi Chakraborty, Rudranil Ghosh, Iravati Harshe, Churni Ganguly, June Maliah, Purav Bhandare, Shridhar Watsar",,,
Mumbai Delhi Mumbai,,,,"Shiv Pandit, Piaa Bajpai",,,
Oh My God,,,,"Akshay Kumar, Paresh Rawal, Mithun Chakraborty, Om Puri, Apoorva Arora, Arun Bali, Honey Chaaya, Poonam Jhawer, Mahesh Manjrekar, Govind Namdeo",,,
One by Two,,,,"Abhay Deol, Preeti Desai, Lillete Dubey, Rati Agnihotri, Jayant Kripalani, Darshan Jariwala, Anish Trivedi, Geetika Tyagi, Preetika Chawla, Tahir Raj Bhasin",,,
Only,,,,"Freida Pinto, Leslie Odom Jr., Chandler Riggs, Jayson Warner Smith, Joshua Mikel, Mark Ashworth, Tia Hendricks, Richard Hempton, Noor Naghmi, Maggie Parto",,,
Penalty,,,,"Lukram Smil, Manjot Singh, Shashank Arora, Kay Kay Menon, Aakash Dabhade, Srishti Jain, Bijou Thaangjam, Mohit Nain, Ashwin Kaushal",,,
Players,,,,"Vinod Khanna, Abhishek Bachchan, Bobby Deol, Sonam Kapoor, Bipasha Basu, Neil Nitin Mukesh, Sikander Kher, Omi Vaidya, Johny Lever, Shweta Bhardwaj",,,
Pyaar Ka Punchnama 2,,,,"Kartik Aaryan, Nushrat Bharucha, Sonalli Sehgall, Sunny Singh, Ishita Raj, Omkar Kapoor, Sharat Saxena, Mona Ambegaonkar",,,
Queen,,,,"Kangana Ranaut, Rajkummar Rao, Lisa Haydon, Mish Boyko, Jeffrey Chee Eng Ho, Marco Canadea, Sabeeka Imam, Yogendra Tikku",,,
Shaitan,,,,"Rajeev Khandelwal, Kalki Koechlin, Gulshan Devaiah, Shiv Pandit, Kirti Kulhari, Neil Bhoopalam, Nikhil Chinappa, Rajit Kapoor, Rajkummar Rao, Pavan Malhotra",,,
Special 26,,,,"Akshay Kumar, Manoj Bajpayee, Anupam Kher, Jimmy Shergill, Kajal Aggarwal, Divya Dutta, Kharaj Mukherjee, Rajesh Sharma, Kishore Kadam, Neeru Bajwa, Deep Raj Rana, Neetu Singh",,,
Tanu Weds Manu,,,,"Madhavan, Kangana Ranaut, Jimmy Shergill, Deepak Dobriyal, Swara Bhaskar, Eijaz Khan, K.K. Raina, Rajendra Gupta, Ravi Kishan, Navni Parihar",,,
What the Fish,,,,"Dimple Kapadia, Vishal Sharma, Sumit Suri, Anand Tiwari, Deepti Pujari, Manu Rishi Chadha, Geetika Tyagi, Manjot Singh, Sabina Sheema",,,
Desperados,,,,"Nasim Pedrad, Anna Camp, Lamorne Morris, Heather Graham, Robbie Amell, Sarah Burns, Jessica Chaffin",,,
Hunter in the Blue Side of Manchester,,,,"Adipati Dolken, Ganindra Bimo, Donny Alamsyah, Vonny Cornellya, Tania Staite, Maurice Bryrne, Kevin Bzezovski Taroreh",,,
I Am Not Your Negro,,,,"Samuel L. Jackson, Joey Starr",,,
The Perfect Picture: Ten Years Later,,,,"Jackie Appiah, Naa Ashorkor Mensa-Doku, Lydia Forson, Adjetey Anang, Richard Mofe-Damijo, Chris Attoh, Gideon Okeke, Joselyn Dumas, John Dumelo, Beverly Naya",,,
Thiago Ventura: POKAS,,,,Thiago Ventura,,,
#AnneFrank - Parallel Stories,,,,"Helen Mirren, Gengher Gatti",,,
Adú,,,,"Luis Tosar, Anna Castillo, Álvaro Cervantes, Miquel Fernández, Jesús Carroza, Moustapha Oumarou, Adam Nourou, Zayidiyya Dissou, Ana Wagener, Nora Navas",,,
Ali Baba ve 7 Cüceler,,,,"Cem Yılmaz, Irina Ivkina, Çetin Altay, Zafer Algöz, Can Yılmaz, Bahtiyar Engin, Fevzi Gökçe, Yosi Mizrahi",,,
David Foster: Off the Record,,,,David Foster,,,
Double Jeopardy,,,,"Tommy Lee Jones, Ashley Judd, Bruce Greenwood, Annabeth Gish, Roma Maffia, Jay Brazeau, Michael Gaston, Daniel Lapaine",,,
Pek Yakında,,,,"Cem Yılmaz, Tülin Özen, Ozan Güven, Özkan Uğur, Zafer Algöz, Cengiz Bozkurt, Cahit Gök, Bahtiyar Engin, Mazhar Alanson, Metin Coşkun, Tuğrul Tülek",,,
Stardust,,,,"Claire Danes, Michelle Pfeiffer, Robert De Niro, Charlie Cox, Sienna Miller, Ricky Gervais, Jason Flemyng, Rupert Everett, Peter O'Toole, Mark Strong, Kate Magowan, Ian McKellen",,,
The F**k-It List,,,,"Eli Brown, Madison Iseman, Marcus Scribner, Jerry O'Connell, Karan Brar, Tristan Lake Leabu, Peter Facinelli, Natalie Zea",,,
The Silence of Others,,,,,,,
Total Recall,,,,"Arnold Schwarzenegger, Rachel Ticotin, Sharon Stone, Michael Ironside, Ronny Cox, Marshall Bell, Michael Champion, Mel Johnson Jr., Roy Brocksmith, Rosemary Dunsmore",,,
Under the Riccione Sun,,,,"Cristiano Caccamo, Lorenzo Zurzolo, Ludovica Martino, Davide Calgaro, Matteo Oscar Giuggioli, Saul Nanni, Fotinì Peluso, Claudia Tranchese, Isabella Ferrari, Luca Ward, Andrea Roncato, Giulia Schiavo, Maria Luisa De Crescenzo, Sergio Ruggeri, Rosanna Sapia, Tommaso Paradiso",,,
George Lopez: We'll Do It For Half,,,,George Lopez,,,
The Mirror Boy,,,,"Edward Kagutuzi, Genevieve Nnaji, Osita Iheme, Fatima Jabbe, Victor Carvalho, Felix Ceesay, John Charles Njie, Momodu Musa Ceesay",,,
#FriendButMarried 2,,,,"Adipati Dolken, Mawar de Jongh, Sari Nila, Vonny Cornellya, Clay Gribble, Ivan Leonardy, Sarah Sechan, Jourdy Pranata",,,
Skin,,,,Beverly Naya,,,
Thackeray (Marathi),,,,"Nawazuddin Siddiqui, Amrita Rao, Rajeev Panday, Sanjay Narvekar, Rajesh Khera, Prakash Belawadi, Avantika Akerkar",,,
Ride Like a Girl,,,,"Teresa Palmer, Sam Neill, Sullivan Stapleton, Stevie Payne, Brooke Satchwell, Magda Szubanski, Aaron Glenane, Damien Garvey, Sophia Crawford, Henry Nixon",,,
Eurovision Song Contest: The Story of Fire Saga,,,,"Will Ferrell, Rachel McAdams, Dan Stevens, Melissanthi Mahut, Mikael Persbrandt, Ólafur Darri Ólafsson, Graham Norton, Demi Lovato, Pierce Brosnan",,,
Kasanova,,,,"Wale Ojo, Ireti Doyle, Alvin Abayomi, Toyin Abraham, Ruby Akubueze, Chimezie Imo, Tomiwa Tegbe",,,
Ordinary People,,,,"Ronwaldo Martin, Hasmine Killip, Maria Isabel Lopez, Raymond Lee, Erlinda Villalobos, Sue Prado",,,
Seven (Tamil),,,,,,,
Seven (Telugu),,,,,,,
Thackeray (Hindi),,,,"Nawazuddin Siddiqui, Amrita Rao, Rajeev Panday, Sanjay Narvekar, Rajesh Khera, Prakash Belawadi, Avantika Akerkar",,,
Krishna and His Leela,,,,"Siddhu Jonnalagadda, Shraddha Srinath, Seerat Kapoor, Shalini Vadnikatti, Jhansi, Viva Harsha, Sampath Raj, Samyuktha Hornad",,,
Prem Ratan Dhan Payo,,,,"Salman Khan, Sonam Kapoor, Anupam Kher, Neil Nitin Mukesh, Sanjay Mishra, Swara Bhaskar, Deepak Dobriyal, Arman Kohli, Manoj Joshi, Samaira Rao, Karuna Pandey, Sucheta Khanna",,,
Vivah,,,,"Shahid Kapoor, Amrita Rao, Anupam Kher, Alok Nath, Seema Biswas, Samir Soni, Lata Sabharwal, Manoj Joshi, Dinesh Lamba, Amrita Prakash",,,
Athlete A,,,,,,,
Bulbbul,,,,"Tripti Dimri, Avinash Tiwary, Rahul Bose, Parambrata Chatterjee, Paoli Dam, Veera Kapur Ee",,,
Nobody Knows I'm Here,,,,"Jorge García, Millaray Lobos, Luis Gnecco, Alejandro Goic, Gastón Pauls, Eduardo Paxeco",,,
Eric Andre: Legalize Everything,,,,Eric André,,,
Kappela,,,,"Anna Ben, Roshan Mathew, Sreenath Bhasi, Sudhi Koppa, Tanvi Ram, Musthafa, James Eliya, Vijilesh",,,
The Royal Hibiscus Hotel,,,,"Zainab Balogun, Kenneth Okolie, Deyemi Okanlawon, Joke Silva, Olu Jacobs, Jide Kosoko, Rachel Oniga, Kemi Lala Akindoju, Ini Dima-Okojie, Toni Tones",,,
Woodshock,,,,"Kirsten Dunst, Joe Cole, Pilou Asbæk, Jack Kilmer, Steph DuVall, Susan Traylor, Joel McCoy, Michael Pavlicek",,,
Elevator Baby,,,,"Toyin Abraham, Timini Egbuson, Shaffy Bello, Yemi Solade, Broda Shaggi, Sambasa Nzeribe, Ijeoma Aniebo, Blessing Onwukwe",,,
Chaman Bahaar,,,,"Jitendra Kumar, Ritika Badiani, Yogendra Tikku, Bhuvan Arora, Alam Khan, Dhirendra Tiwari, Ashwani Kumar, Bhagwan Tiwari",,,
Destiny,,,,"Nour El-Sherif, Laila Elwi, Mahmoud Hemeida, Safia el-Emari, Mohamed Mounir, Khaled El Nabawy, Seif Abdelrahman, Abdalla Mahmoud, Ahmed Fouad Selim, Magdi Idris",,,
Disclosure,,,,,,,
Feel the Beat,,,,"Sofia Carson, Wolfgang Novogratz, Donna Lynne Champlin, Eva Hauge, Rex Lee, Brandon Kyle Goodman, Lidya Jewett, Sadie Lapidus, Johanna Colón, Shaylee Mansfield, Shiloh Nelson, Justin Allan, Carina Battrick, Kai Zen, Marissa Jaret Winokur, Enrico Colantoni, Dennis Andres",,,
Lost Bullet,,,,"Alban Lenoir, Nicolas Duvauchelle, Ramzy Bedia, Stéfi Celma, Rod Paradot, Sébastien Lalanne, Pascale Arbillot, Arthur Aspaturian, Patrick Médioni",,,
One-Way to Tomorrow,,,,"Dilan Çiçek Deniz, Metin Akdülger",,,
The Emigrant,,,,"Khaled El Nabawy, Hanan Turk, Yousra, Mahmoud Hemeida, Safia el-Emari, Michel Piccoli, Ahmed Bedir",,,
Wasp Network,,,,"Penélope Cruz, Edgar Ramírez, Wagner Moura, Gael García Bernal, Ana de Armas, Leonardo Sbaraglia",,,
A Whisker Away,,,,"Mirai Shida, Natsuki Hanae, Hiroaki Ogi, Koichi Yamadera, Minako Kotobuki, Susumu Chiba, Ayako Kawasumi, Sayaka Ohara, Daisuke Namikawa",,,
Alexandria ... Why?,,,,"Naglaa Fathi, Farid Shawqy, Mohsen Mohiedine, Ezzat El Alaili, Abdalla Mahmoud, Youssef Wahby, Yehia Chahine, Laila Fawzy, Mahmoud El Meleigy, Ahmed Zaki, Gerry Sundquist",,,
Alexandria: Again and Forever,,,,"Youssef Chahine, Yousra, Hussein Fahmy, Amr Abdel-Geleel, Taheya Cariocca, Hesham Selim, Huda Sultan, Ragaa Hussein",,,
An Egyptian Story,,,,"Nour El-Sherif, Magda El-Khatib, Yousra, Mohsen Mohiedine, Oussama Nadir, Layla Hamadah, Mohamed Mounir, Ragaa Hussein",,,
Cairo Station,,,,"Farid Shawqy, Hind Rostom, Youssef Chahine, Hassan el Baroudi, Abdel Aziz Khalil, Naima Wasfy, Said Khalil, Abdel Ghani Nagdi",,,
Dark Waters,,,,"Faten Hamama, Omar Sharif, Ahmed Ramzy, Hussein Riad, Ferdoos Mohammed, Aziza Helmy, Tawfik El Deken",,,
El límite infinito,,,,Jean Maggi,,,
Lola Igna,,,,"Angie Ferro, Yves Flores, Meryll Soriano, Maria Isabel Lopez, Royce Cabrera, Jojo Riguerra, Soliman Cruz, Armand Reyes",,,
One Take,,,,BNK48,,,
Saladin,,,,"Ahmad Mazhar, Salah Zo El Faqqar, Nadia Lotfi, Hamdy Gheith, Laila Fawzy, Omar El-Hariri, Laila Taher, Hussein Riad, Mahmoud El Meleigy, Zaki Tolaimat",,,
Stray Bullet,,,,"Nadine Labaky, Takla Chamoun, Hend Taher, Badih Abou Chakra, Rodrigue Sleiman, Nazih Youssef, Patricia Nammour, Pauline Haddad, Nasri Sayegh, Joelle Hannah, Inaam Germanos",,,
The Blazing Sun,,,,"Omar Sharif, Faten Hamama, Zaki Rostom, Farid Shawqy, Abdel-Wareth Asar, Menassa Fahmy, Abdelghany Kamar, Hamdy Gheith, Mohsen Hassanein, Rafeaa El Shal",,,
The Land,,,,"Hamdy Ahmed, Nagwa Ibrahim, Ezzat El Alaili, Tawfik El Deken, Yehia Chahine, Mahmoud El Meleigy, Salah El-Saadany, Ali El Sherif",,,
The Nut Job,,,,"Will Arnett, Brendan Fraser, Gabriel Iglesias, Jeff Dunham, Liam Neeson, Katherine Heigl, Stephen Lang, Maya Rudolph, Sarah Gadon, James Rankin",,,
An Evening with Beverly Luff Linn,,,,"Aubrey Plaza, Emile Hirsch, Jemaine Clement, Craig Robinson, Matt Berry, Zach Cherry, Maria Bamford, Michael D. Cohen, Sky Elobar, Jacob Wysocki, John Kerry, Bettina Devin, Gil Gex",,,
Riding Faith,,,,"John Schneider, T.C. Stallings, Grace Van Dien, Marisa Brown, Jimmy Deshler",,,
Last Flight to Abuja,,,,"Omotola Jalade-Ekeinde, Hakeem Kae-Kazim, Jim Iyke, Ali Nuhu, Jide Kosoko, Anthony Monjaro, Jennifer Oguzie, Uru Eke, Celine Loader",,,
The Darkness,,,,"Kevin Bacon, Radha Mitchell, David Mazouz, Lucy Fry, Matt Walsh, Jennifer Morrison, Parker Mack, Paul Reiser, Ming-Na Wen, Tara Lynne Barr",,,
The Show Must Go On: The Queen + Adam Lambert Story,,,,"Adam Lambert, Brian May, Roger Taylor",,,
Underdogs,,,,"Ariana Grande, Nicholas Hoult, Matthew Morrison, Eugenio Derbez, Taran Killam, Bobby Moynihan, Bella Thorne, Jay Pharoah, Dan Patrick, Shawn Mendes, Brooklyn Beckham, Chazz Palminteri, John Leguizamo, Mel Brooks, Rupert Grint, Rob Brydon, Anthony Head, Ralf Little, Eve Ponsonby, Peter Serafinowicz, Alex Norton, Alistair McGowan, Ezequiel Cipols",,,
