title,,,,cast,,,
Ghost Whispers,,,,"Maaya Sakamoto, Ikkyu Juku, Kenichirou Matsuda, Tomoyuki Dan, Takuro Nakakuni, Yoji Ueda, Kazuya Nakai, Miyuki Sawashiro, Ikuya Sawaki, Takako Fuji",,,
Ghulam-E-Musthafa,,,,"Nana Patekar, Raveena Tandon, Paresh Rawal, Aruna Irani, Mohan Joshi, Mohnish Bahl, Shivaji Satham, Vishwajeet Pradhan, Ashwin Kaushal, Satish Shah",,,
Gie,,,,"Nicholas Saputra, Sita Nursanti, Lukman Sardi, Indra Birowo, Wulan Guritno, Thomas Nawilis, Tutie Kirana, Robby Tumewu, Jonathan Mulia",,,
Gigi,,,,"Leslie Caron, Maurice Chevalier, Louis Jourdan, Hermione Gingold, Eva Gabor, Jacques Bergerac, Isabel Jeans, John Abbott, Edwin Jerome, Corinne Marchand",,,
Ginger & Rosa,,,,"Elle Fanning, Alessandro Nivola, Christina Hendricks, Alice Englert, Timothy Spall, Oliver Platt, Annette Bening, Jodhi May, Oliver Milburn, Andrew Hawley",,,
"Girl, Boy, Bakla, Tomboy",,,,"Vice Ganda, Maricel Soriano, Joey Marquez, Ruffa Gutierrez, Cristine Reyes, JC de Vera, Ejay Falcon, Angelu De Leon, Bobby Andrews",,,
GLOW: The Story of the Gorgeous Ladies of Wrestling,,,,,,,
God Bless the Broken Road,,,,"Patrika Darbo, Kim Delaney, Jordin Sparks, Makenzie Moss, Liam Matthews, Andrew W. Walker, Lindsay Pulsipher, Gary Grubbs, Robin Givens, Arthur Cartwright",,,
God Knows Where I Am,,,,Lori Singer,,,
God of War,,,,"Vincent Zhao, Sammo Kam-Bo Hung, Regina Wan, Yasuaki Kurata, Keisuke Koide, Timmy Hung, Michael Tong",,,
God's Not Dead,,,,"Kevin Sorbo, Shane Harper, David A.R. White, Dean Cain, Benjamin A. Onyango, Paul Kwo, Hadeel Sittu, Trisha LaFache, Cory Oliver, Willie Robertson, Korie Robertson",,,
God's Not Dead: A Light in Darkness,,,,"David A.R. White, John Corbett, Shane Harper, Ted McGinley, Jennifer Taylor, Benjamin A. Onyango, Tatum O'Neal, Cissy Houston",,,
God's Own Country,,,,"Josh O'Connor, Alec Secareanu, Ian Hart, Gemma Jones",,,
Gol Maal,,,,"Amol Palekar, Bindiya Goswami, Deven Verma, Utpal Dutt, Shubha Khote, Manju Singh, Dina Pathak, Pushpa, David Abraham, Asrani",,,
Golden Time,,,,,,,
GoldenEye,,,,"Pierce Brosnan, Sean Bean, Izabella Scorupco, Famke Janssen, Joe Don Baker, Judi Dench, Robbie Coltrane, Gottfried John, Alan Cumming, Tchéky Karyo, Desmond Llewelyn, Samantha Bond, Michael Kitchen, Serena Gordon, Simon Kunz",,,
Goldie,,,,"Slick Woods, George Sample III, Shaquila Angela Griszell, Danny Hoch, Khris Davis, Jazmyn Davis, Alana Tyler-Tomkins, Fran Jaye",,,
Goldstone,,,,"Aaron Pedersen, Alex Russell, Jacki Weaver, Cheng Pei-pei, David Gulpilil, Michelle Lim Davidson, David Wenham, Tommy Lewis, Tommy Caldwell",,,
Golmaal: Fun Unlimited,,,,"Ajay Devgn, Tusshar Kapoor, Arshad Warsi, Sharman Joshi, Paresh Rawal, Rimi Sen, Sushmita Mukherjee, Vrajesh Hirjee",,,
Gone are the Days,,,,"Lance Henriksen, Tom Berenger, Meg Steedle, Danny Trejo",,,
Good Kids,,,,"Nicholas Braun, Zoey Deutch, Mateo Arias, Israel Broussard, Dayo Okeniyi, Julia Garner, Kevin Chapman, Ashley Judd",,,
Good Kill,,,,"Ethan Hawke, January Jones, Bruce Greenwood, Zoë Kravitz, Jake Abel, Ryan Montano, Dylan Kenin, Stafford Douglas",,,
Good Kisser,,,,"Kari Alison Hodge, Rachel Paulson, Julia Eringer",,,
Good Luck,,,,"Ahmed Eid, May Kassab, Diaa El Merghany, Samy Maghawry, Badria Tolba, Hassan Abdulfattah, Ahmed Safwat, Sayed Sadek, Laila Gamal",,,
"Good Night, and Good Luck",,,,"David Strathairn, Patricia Clarkson, George Clooney, Jeff Daniels, Robert Downey Jr., Frank Langella, Ray Wise, Robert John Burke, Tate Donovan, Alex Borstein, Matt Ross, Grant Heslov",,,
Good People,,,,"James Franco, Kate Hudson, Tom Wilkinson, Omar Sy, Sam Spruell, Anna Friel, Thomas Arnold, Oliver Dimsdale, Diana Hardcastle, Michael Jibson, Diarmaid Murtagh",,,
GoodFellas,,,,"Robert De Niro, Ray Liotta, Joe Pesci, Lorraine Bracco, Paul Sorvino, Frank Sivero, Tony Darrow, Mike Starr, Frank Vincent, Chuck Low",,,
Gook,,,,"Simone Baker, Justin Chon, David So, Curtiss Cook Jr., Sang Chon, Ben Munoz, Omono Okojie, Isaiah Jarel",,,
Goon,,,,"Seann William Scott, Jay Baruchel, Liev Schreiber, Alison Pill, Marc-André Grondin, Kim Coates, Eugene Levy, Nicholas Campbell, Richard Clarkin, Jonathan Cherry",,,
Goosebumps 2: Haunted Halloween,,,,"Jeremy Ray Taylor, Madison Iseman, Caleel Harris, Wendi McLendon-Covey, Chris Parnell, Ken Jeong, Jack Black",,,
Gosford Park,,,,"Eileen Atkins, Bob Balaban, Alan Bates, Charles Dance, Stephen Fry, Michael Gambon, Richard E. Grant, Tom Hollander, Derek Jacobi, Kelly Macdonald, Helen Mirren, Jeremy Northam, Clive Owen, Ryan Phillippe, Maggie Smith, Geraldine Somerville, Kristin Scott Thomas, Sophie Thompson, Emily Watson, James Wilby",,,
Gothika,,,,"Halle Berry, Robert Downey Jr., Charles S. Dutton, John Carroll Lynch, Bernard Hill, Penélope Cruz, Dorian Harewood, Bronwen Mantel",,,
Gour Hari Dastaan: The Freedom File,,,,"Vinay Pathak, Konkona Sen Sharma, Ranvir Shorey, Tannishtha Chatterjee, Rajit Kapoor, Vikram Gokhale, Vipin Sharma, Rahul Vohra, Saurabh Shukla, Asrani",,,
Gran Torino,,,,"Clint Eastwood, Bee Vang, Ahney Her, Christopher Carley, John Carroll Lynch, Brian Haley, Geraldine Hughes, Brian Howe, William Hill, Dreama Walker",,,
Grand Masti,,,,"Riteish Deshmukh, Vivek Oberoi, Aftab Shivdasani, Suresh Menon, Manjari Fadnis, Sonalee Kulkarni, Karishma Tanna, Kainaat Arora, Bruna Abdullah, Maryam Zakaria, Pradeep Singh Rawat",,,
Grass,,,,"Emily Chang, Pia Shah, Anthony Ma",,,
Grease,,,,"John Travolta, Olivia Newton-John, Stockard Channing, Jeff Conaway, Barry Pearl, Michael Tucci, Kelly Ward, Didi Conn, Jamie Donnelly, Dinah Manoff, Eve Arden, Dody Goodman, Sid Caesar, Joan Blondell, Frankie Avalon",,,
Green Room,,,,"Anton Yelchin, Imogen Poots, Patrick Stewart, Alia Shawkat, Joe Cole, Callum Turner, Macon Blair, David W. Thompson, Mark Webber, Eric Edelstein, Kai Lennox",,,
Green White Green (And All the Beautiful Colours in My Mosaic of Madness),,,,"Ifeanyi Dike Jr., Jamal Ibrahim, Samuel Robinson, Cristabel Goddy, Okey Uzoeshi, Bimbo Manuel, Meg Otanwa, Eric Didie, Donatus Ekwuazi, Omoye Uzamere",,,
Gringo: The Dangerous Life of John McAfee,,,,,,,
Growing Up Coy,,,,,,,
Gun Runners,,,,,,,
Guy Martin: Last Flight of the Vulcan Bomber,,,,"Guy Martin, Kevin Stone, Shaun Dooley",,,
Héroes,,,,"Fabrizio Copano, Juanita Ringeling, Fernando Alarcón, Delfina Guzmán, Paty Cofré, Andrés Rillón, Julio Jung, Nicolás Oyarzún",,,
Hükümet Kadin,,,,"Demet Akbağ, Sermiyan Midyat, Mahir İpek, Gülhan Tekin, Burcu Gönder, Cezmi Baskın, Renan Bilek, Ayberk Attila, Rıza Akın, Bülent Çolak",,,
Hükümet Kadin 2,,,,"Demet Akbağ, Sermiyan Midyat, Mahir İpek, Gülhan Tekin, Burcu Gönder, Mine Şenhuy Teber, Osman Alkaş, Bülent Çolak, Olgun Toker, Doğukan Polat",,,
Haapus,,,,"Makarand Anaspure, Madhura Velankar, Subodh Bhave",,,
Hadi İnşallah,,,,"Büşra Pekin, Murat Boz, Cezmi Baskın, Şinasi Yurtsever, İdil Dizdar, Hülya Gülsen Irmak, Canan Özer, Şenay Bozoklar, Emrah Kaman, Müjde Uzman",,,
Hairspray,,,,"Nikki Blonsky, John Travolta, Michelle Pfeiffer, Christopher Walken, Amanda Bynes, James Marsden, Queen Latifah, Zac Efron, Brittany Snow, Allison Janney, Elijah Kelley, Jerry Stiller",,,
HALO Legends,,,,"Andy McAvin, James Faulkner, Luci Christian, John Swasey",,,
Halo: The Fall of Reach,,,,"Jen Taylor, Steve Downes, Michelle Lukes, Britt Baron, Travis Willingham, John Bently, Todd Haberkorn, Cole Jensen",,,
Hamara Dil Aapke Paas Hai,,,,"Anil Kapoor, Aishwarya Rai Bachchan, Sonali Bendre, Puru Rajkumar, Anupam Kher, Satish Kaushik, Mukesh Rishi, Jaspal Bhatti, Razak Khan, Himani Shivpuri, Smita Jaykar, Tanaaz Currim Irani",,,
Hamburger Hill,,,,"Anthony Barille, Michael Boatman, Don Cheadle, Michael Dolan, Don James, Dylan McDermott, Michael A. Nickles, Harry O'Reilly, Daniel O'Shea, Tim Quill, Tommy Swerdlow, Courtney B. Vance, Steven Weber, Tegan West",,,
Hamza's Suitcase,,,,"Hamada Helal, Yousra El Lozy, Ahmed Fathy, Mohammed Tharwat, Samia Trabelsi, Diaa El-Merghani, Abdalah Mishrif, Mohamed Metwalli, Samy Maghawry, Bayoumi Fouad, Inas al-Najjar, Taher Abu Lela",,,
Hangman,,,,"Al Pacino, Karl Urban, Brittany Snow, Joe Anderson, Sarah Shahi, Sloane Warren, Chelle Ramos, Steve Coulter, Michael Rose",,,
Hank: Five Years from the Brink,,,,"Henry Paulson, Wendy Paulson",,,
Hans Zimmer: Live in Prague,,,,Hans Zimmer,,,
Happy Hunting,,,,"Martin Dingle-Wall, Ken Lally, Kenny Wormald, Connor Williams, Gary Sturm, C.J. Baker, Jeremy Lawson, Liesel Hanson, Kenneth Billings, Michael Tipps",,,
Happy Times,,,,"Luis Arrieta, Cassandra Ciangherotti, Humberto Busto, Iván Arana, Bárbara de Regil, Miguel Rodarte",,,
Hard Tide,,,,"Nathanael Wiseman, Mem Ferda, Alexandra Newick, Oliver Stark, Kat Gellin, Andy Lucas, Ralph Brown, Beverly Hills",,,
Hardcore Henry,,,,"Sharlto Copley, Danila Kozlovsky, Haley Bennett, Andrey Dementiev, Dasha Charusha, Svetlana Ustinova, Tim Roth, Ilya Naishuller",,,
Harlem Globetrotters: The Team That Changed the World,,,,"Chuck D., Harlem Globetrotters",,,
Harold & Kumar Escape from Guantanamo Bay,,,,"John Cho, Kal Penn, Rob Corddry, Jack Conley, Roger Bart, Neil Patrick Harris, Danneel Ackles, Eric Winter, Paula Garcés, Jon Reep, Missi Pyle",,,
Harold & Kumar Go to White Castle,,,,"John Cho, Kal Penn, Paula Garcés, Neil Patrick Harris, David Krumholtz, Eddie Kaye Thomas, Christopher Meloni, Ryan Reynolds, Fred Willard",,,
Harold and Lillian: A Hollywood Love Story,,,,"Harold Michelson, Lillian Michelson, Mel Brooks, Francis Ford Coppola, Danny DeVito",,,
Harriet the Spy: Blog Wars,,,,"Jennifer Stone, Kristin Booth, Wesley Morgan, Doug Murray, Shauna MacDonald, Jason Blicker, Jayne Eastwood, Melinda Shankar, Alexander Conti, Vanessa Morgan",,,
Harry and Snowman,,,,Harry DeLeyer,,,
Harry Benson: Shoot First,,,,Harry Benson,,,
Haseena Maan Jaayegi,,,,"Sanjay Dutt, Govinda, Karisma Kapoor, Pooja Batra, Kader Khan, Paresh Rawal, Satish Kaushik, Aruna Irani, Anupam Kher, Ashish Vidyarthi, Aashif Sheikh, Asrani, Razak Khan, Shakti Kapoor, Bindu, Mahavir Shah, Mohan Joshi, Anil Dhawan",,,
Haunters: The Art of the Scare,,,,,,,
Haunting on Fraternity Row,,,,"Jacob Artist, Jayson Blair, Shanley Caswell, Claudia Lee, Ashton Moio, Cameron Moulene, Molly Tarlov, Chester Rushing",,,
Have You Seen the Listers?,,,,Anthony Lister,,,
Havenhurst,,,,"Julie Benz, Belle Shouse, Josh Stamberg, Danielle Harris, Douglas Tait, Matt Lasky, Dendrie Taylor, Toby Huss, Jennifer Blanc, Fionnula Flanagan",,,
Haywire,,,,"Gina Carano, Michael Fassbender, Ewan McGregor, Bill Paxton, Channing Tatum, Antonio Banderas, Mathieu Kassovitz, Michael Angarano, Michael Douglas, Anthony Brandon Wong",,,
He Named Me Malala,,,,Malala Yousafzai,,,
He's Out There,,,,"Yvonne Strahovski, Anna Pniowsky, Abigail Pniowsky, Ryan McDonald, Justin Bruening, Julian Bailey",,,
Head Count,,,,"Isaac Jay, Ashleigh Morghan, Bevin Bru, Billy Meade, Hunter Peterson, Chelcie May, Tory Freeth, Michael Herman, Amaka Obiechie, Sam Marra, Cooper Rowe",,,
Head On,,,,"Alex Dimitriades, Paul Capsis, Julian Garner, Tony Nikolakopoulos, Elena Mandalis, Eugenia Fragos, Damien Fotiou, Andrea Mandalis, Maria Mercedes, Dora Kaskanis, Alex Papps, Vassili Zappa",,,
Heal,,,,"Kelly Noonan, Deepak Chopra, Michael Beckwith, Joe Dispenza, Dr. Jeffrey Thompson, Gregg Braden, Joan Borysenko, Marianne Williamson",,,
Heartbreakers,,,,"Sigourney Weaver, Jennifer Love Hewitt, Ray Liotta, Jason Lee, Gene Hackman, Anne Bancroft, Jeffrey Jones, Nora Dunn, Ricky Jay, Zach Galifianakis",,,
Heartthrob,,,,"Aubrey Peeples, Keir Gilchrist, Peter Facinelli, Felicity Price, Ione Skye, Jimmy Bennett, Taylor Dearden",,,
Hedgehogs,,,,"Anthony Padilla, Ian Hecox, Jenn McAllister, Jon Heder, Chevy Chase",,,
Hell and Back,,,,"Nick Swardson, Mila Kunis, Bob Odenkirk, T.J. Miller, Rob Riggle, Susan Sarandon, Danny McBride, Jennifer Coolidge, John Farley, Maria Bamford",,,
Hell or High Water,,,,"Jeff Bridges, Chris Pine, Ben Foster, Gil Birmingham, Marin Ireland, Katy Mixon, Dale Dickey, Kevin Rankin, William Sterchi",,,
Hellboy,,,,"Ron Perlman, John Hurt, Selma Blair, Rupert Evans, Karel Roden, Jeffrey Tambor, Doug Jones, Brian Steele, Ladislav Beran, Biddy Hodson, Corey Johnson, Kevin Trainor",,,
Her,,,,"Joaquin Phoenix, Scarlett Johansson, Amy Adams, Rooney Mara, Olivia Wilde, Chris Pratt, Matt Letscher, Portia Doubleday",,,
Her Only Choice,,,,"Denise Boutte, Timon Kyle Durrett, Leon, Tamara Tunie, Vanessa Bell Calloway, Tiffany Snow, Keith Arthur Bolden, Elise Neal, Jeryl Prescott",,,
Hera Pheri,,,,"Amitabh Bachchan, Vinod Khanna, Saira Banu, Sulakshana Pandit, Shreeram Lagoo, Pinchoo Kapoor, P. Jairaj, Yunus Parvez",,,
Here Alone,,,,"Lucy Walters, Gina Piersanti, Adam David Thompson, Shane West, Ryken A. Whitfield, Abel McSurely Bradshaw, Rebecca Spiro",,,
Hero,,,,"Takeshi Kaneshiro, Yuen Biao, Valerie Chow, Jessica Hester Hsuan, Tak Yuen, Wah Yuen, Corey Yuen",,,
Hickok,,,,"Luke Hemsworth, Trace Adkins, Kris Kristofferson, Bruce Dern, Cameron Richardson, Kaiwi Lyman, Hunter Fischer, Robert Catrini, Britain Simons",,,
Hide & Seek,,,,"Purab Kohli, Arjan Bajwa, Mrinalini Sharma, Sameer Kochhar, Ayaz Khan, Amruta Patki, Pavail Gulati, Prashant, Amol Mhatre",,,
Hide and Seek,,,,"Wallace Huo, Qin Hailu, Regina Wan, Jessie Li, Dong Zijian, Li Yiqing, Fan Qianhui",,,
Highly Strung,,,,,,,
Hiroshima: The Real History,,,,John Sessions,,,
Hisss,,,,"Mallika Sherawat, Irrfan Khan, Jeff Doucette, Divya Dutta, Raman Trikha, Mahmoud Babai, Raj Bhansali, Sunny Charles, Tony Ciccone, Parvez Khan",,,
History of Joy,,,,"Vishnu Vinay, Vinay Forrt, Saikumar, Joju George, Nobi, Sreekumar, Nandu, Sunil Sukhada",,,
Hitch,,,,"Will Smith, Eva Mendes, Kevin James, Amber Valletta, Julie Ann Emery, Adam Arkin, Robinne Lee, Nathan Lee Graham, Michael Rapaport, Jeffrey Donovan",,,
Hitler's Olympics,,,,,,,
Hitler's Steel Beast,,,,,,,
Ho Mann Jahaan,,,,"Adeel Hussain, Mahira Khan, Sheheryar Munawar, Sonya Jehan, Bushra Ansari, Nimra Bucha, Arshad Mahmud, Jamal Shah",,,
Hokkabaz,,,,"Cem Yılmaz, Mazhar Alanson, Özlem Tekin, Tuna Orhan, Tuncer Salman, Kemal İnci, Gürgen Öz, Caner Alkaya, Ayçe Abana, Bahtiyar Engin",,,
Holding the Man,,,,"Ryan Corr, Craig Stott, Kerry Fox, Camilla Ah Kin, Sarah Snook, Guy Pearce, Anthony LaPaglia, Geoffrey Rush",,,
Holidays,,,,"Madeleine Coghlan, Savannah Kennick, Ruth Bradley, Ava Acres, Sophie Traub, Jocelin Donahue, Harley Morenstein, Harley Quinn Smith, Ashley Greene, Olivia Roush, Seth Green, Clare Grant, Lorenza Izzo, Andrew Bowen",,,
Holy Hell,,,,,,,
Holy Man 2,,,,"Apisit Opasaimlikit, Suthep Po-ngam, Phichet Iamchaonaa, Note Chern-Yim",,,
Holy Man 3,,,,"Krissada Sukosol, Natee Aekwijit, Yoakyake Chernyim, Der Doksadao, Note Chern-Yim, Kohtee Aramboy, Chaleumpol Tikumpornteerawong",,,
Hombanna,,,,"Subbu Talabi, Dhanu Gowda, H.G. Dattatreya, Suchendra Prasad, Ambujakshi, Neenasam Ashwath",,,
Homeland,,,,"Parambrata Chatterjee, Ani Hovhannisyan, Jonathan Dumontier, Varzu, Sylvie de Neef, Prakashchandra Roy, Nicolas Pierson, Anahit Simonyan",,,
Honey 2,,,,"Kat Graham, Mario Lopez, Audrina Patridge, Seychelle Gabriel, Randy Wayne, Brandon Molale, Melissa Molinaro, Jossara Jinaro, Lonette McKee, Laurieann Gibson, Christopher Shazar",,,
Honey: Rise Up and Dance,,,,"Teyana Taylor, Sierra Aylina McClain, Bryshere Gray",,,
Hoodwinked Too! Hood vs. Evil,,,,"Hayden Panettiere, Glenn Close, Patrick Warburton, Joan Cusack, David Ogden Stiers, Bill Hader, Amy Poehler, Andy Dick, Martin Short, Brad Garrett, Cheech Marin, Tommy Chong, Heidi Klum, Wayne Newton",,,
Hope Aur Hum,,,,"Naseeruddin Shah, Kabir Sajid, Sonali Kulkarni, Amir Bashir, Naveen Kasturia, Neha Chauhan, Virti Vaghani",,,
Hope Springs Eternal,,,,"Mia Rose Frampton, Beth Lacke, Stony Blyden, Juliette Angelo, Lauren Giraldo, Beau Brooks, Pej Vahdat",,,
Hope: One in a Billion,,,,Gift Ngoepe,,,
Horns,,,,"Daniel Radcliffe, Juno Temple, Max Minghella, Joe Anderson, Kelli Garner, Heather Graham, David Morse, Kathleen Quinlan, James Remar",,,
Horror Story,,,,"Karan Kundra, Nishant Malkani, Hassan Zaidi, Ravish Desai, Radhika Menon, Aparna Bajpai, Nandini Vaid, Sheetal Singh, Bikramjeet Singh, Masood Akhtar",,,
Hostage to the Devil,,,,,,,
Hostages,,,,,,,
Hostiles,,,,"Christian Bale, Rosamund Pike, Wes Studi, Jesse Plemons, Timothée Chalamet, Ben Foster, Adam Beach, Rory Cochrane, Peter Mullan, Scott Wilson, Paul Anderson, Jonathan Majors, John Benjamin Hickey, Q'orianka Kilcher, Ryan Bingham",,,
Hot Bot,,,,"Cynthia Kirchner, Doug Haley, Zack Pearlman, Larry Miller, Danny Masterson, Anthony Anderson, David Shackelford, Donald Faison, Angela Kinsey, Kirby Bliss Blanton, John Robinson",,,
Hot Property,,,,"MyAnna Buring, Tom Rhys Harries, Ella Smith, Sam Phillips, Kate Bracken",,,
Hot Rod,,,,"Andy Samberg, Jorma Taccone, Bill Hader, Danny McBride, Isla Fisher, Sissy Spacek, Ian McShane, Will Arnett, Chris Parnell, Chester Tam",,,
Hotel Pacific,,,,"Marek Kondrat, Roman Wilhelmi, Roman Skamene, Čestmír Řanda, Michał Pawlicki, Martin Hron, Stanisława Celińska, Joanna Kasperska, Jaroslava Schallerová",,,
Hotel Transylvania 3: Summer Vacation,,,,"Adam Sandler, Selena Gomez, Kevin James, Kathryn Hahn, Andy Samberg, David Spade, Steve Buscemi, Fran Drescher, Molly Shannon, Mel Brooks, Keegan-Michael Key",,,
House at the End of the Street,,,,"Gil Bellows, Max Thieriot, Jennifer Lawrence, Elisabeth Shue, Jordan Hayes, James Thomas, Eva Link, Nolan Gerard Funk, Allie MacDonald, Krista Bridges",,,
House of Z,,,,Zac Posen,,,
"Houston, We Have a Problem!",,,,Slavoj Zizek,,,
How the Beatles Changed the World,,,,"George Harrison, John Lennon, Ringo Starr, Paul McCartney, Brian Epstein",,,
How the Grinch Stole Christmas,,,,"Jim Carrey, Taylor Momsen, Jeffrey Tambor, Christine Baranski, Bill Irwin, Molly Shannon, Clint Howard, Josh Ryan Evans, Mindy Sterling, Anthony Hopkins",,,
How to Be a Latin Lover,,,,"Eugenio Derbez, Salma Hayek, Rob Lowe, Raphael Alejandro, Kristen Bell, Raquel Welch, Linda Lavin, Renée Taylor, Rob Riggle, Rob Corddry, Rob Huebel, Michael Cera, Michaela Watkins",,,
How to Be a Player,,,,"Bill Bellamy, Natalie Desselle, Lark Voorhies, Mari Morrow, Pierre Edwards, Jermaine 'Huggy' Hopkins, Anthony Johnson, Max Julien, Beverly Johnson, Gilbert Gottfried, Bernie Mac",,,
How to Change the World,,,,,,,
How to Make an American Quilt,,,,"Winona Ryder, Anne Bancroft, Ellen Burstyn, Kate Nelligan, Alfre Woodard, Kaelynn Craddick, Sara Craddick, Kate Capshaw, Dermot Mulroney, Adam Baldwin, Maya Angelou, Rip Torn, Joanna Going, Claire Danes, Jean Simmons, Denis Arndt, Johnathon Schaech, Samantha Mathis, Derrick O'Connor, Jared Leto",,,
How to Win the US Presidency,,,,,,,
Hridaynath,,,,"Jackie Shroff, Aditya Pancholi, Swarangi Maharte, Ameya Hunaswadkar, Urmila Matondkar",,,
Hulk Vs.,,,,"Fred Tatasciore, Matthew Wolf, Graham McTavish, Grey DeLisle, Kari Wahlgren, Bryce Johnson, Janyse Jaud, Jay Brazeau, Jonathan Holmes, Paul Dobson, Michael Adamthwaite, French Tickner, Nicole Oliver, Qayam Devji, Steve Blum, Mark Acheson, Colin Murdock, Nolan North, Tom Kane",,,
Hum Saath-Saath Hain,,,,"Salman Khan, Karisma Kapoor, Saif Ali Khan, Tabu, Sonali Bendre, Mohnish Bahl, Mahesh Thakur, Neelam, Alok Nath, Satish Shah",,,
Humko Deewana Kar Gaye,,,,"Akshay Kumar, Katrina Kaif, Bipasha Basu, Bhagyashree, Shernaz Patel, Vivek Shaq, Mahesh Thakur, Ranjeet, Nina Kulkarni, Puneet Issar, Anju Mahendru, Manoj Joshi, Anil Kapoor",,,
Hungerford,,,,"Drew Casson, Georgia Bradley, Sam Carter, Tom Scarlett, Nigel Morgan, Colin Stark, Kitty Speed",,,
Hunt to Kill,,,,"Steve Austin, Gil Bellows, Gary Daniels, Marie Avgeropoulos, Emilie Ullerup, Michael Eklund, Eric Roberts, Michael Hogan, Donnelly Rhodes, Adrian Holmes",,,
Hunter's Prayer,,,,"Sam Worthington, Odeya Rush, Amy Landecker, Allen Leech, Verónica Echegui",,,
Hurricane Bianca,,,,"Roy Haylock, Bianca Leigh, Denton Blane Everett, Willam Belli, D.J. ""Shangela"" Pierce, Justin ""Alyssa Edwards"" Johnson, Molly Ryman, Ted Ferguson, Rachel Dratch, Alan Cumming, Margaret Cho, RuPaul",,,
Hurricane Bianca: From Russia With Hate,,,,"Roy Haylock, Rachel Dratch, Brian McCook, D.J. ""Shangela"" Pierce, Doug Plaut, Cheyenne Jackson, Kristen Johnston, Heather McDonald, Wanda Sykes, Janeane Garofalo",,,
Hustle & Flow,,,,"Terrence Howard, Anthony Anderson, Taryn Manning, Taraji P. Henson, DJ Qualls, Ludacris, Paula Jai Parker, Elise Neal, Isaac Hayes",,,
Hypersomnia,,,,"Yamila Saud, Gerardo Romano, Jimena Barón, Vanesa González, Candela Vetrano, Florencia Torrente, Nazareno Casero, Sofía Gala, Gustavo Garzón, Belén Chavanne, Fabiana Cantilo, Peter Lanzani",,,
I Am,,,,"Juhi Chawla, Rahul Bose, Nandita Das, Sanjay Suri, Manisha Koirala, Purab Kohli, Shernaz Patel, Abhimanyu Singh, Arjun Mathur, Radhika Apte",,,
I Am Bolt,,,,Usain Bolt,,,
I Am Jane Doe,,,,Jessica Chastain,,,
I Am Maris,,,,Maris Degener,,,
I Am Not Madame Bovary,,,,"Fan Bingbing, Guo Tao, Da Peng, Zhang Jiayi, Yu Hewei, Yi Zhao, Zonghan Li, Zhao Lixin, Tian Xiaojie, Yin Yuanzhang, Enhe Feng, Xin Liu, Jiang Yongbo",,,
I Am Sun Mu,,,,,,,
I Am Vengeance,,,,"Stu Bennett, Anna Shaffer, Mark Griffin, Bryan Larkin, Kevin Leslie, Gary Daniels",,,
I Am Wrath,,,,"John Travolta, Christopher Meloni, Amanda Schull, Sam Trammell, Patrick St. Esprit, Rebecca De Mornay, Asante Jones, Paul Sloan, Luis Da Silva Jr., Jordan Whalen",,,
I Don't Know How She Does It,,,,"Sarah Jessica Parker, Pierce Brosnan, Greg Kinnear, Christina Hendricks, Kelsey Grammer, Seth Meyers, Olivia Munn, Jane Curtin, Mark Blum, Busy Philipps, Sarah Shahi, Jessica Szohr",,,
I Dream Of Dance,,,,,,,
I Fine... Thank You... Love You,,,,"Preechaya Pongthananikorn, Sunny Suwanmethanont, Sora Aoi, Puttachat Pongsuchat, Popetorn Soonthornyanakij",,,
"I, Daniel Blake",,,,"Dave Johns, Hayley Squires, Briana Shann, Dylan McKiernan, Kate Rutter, Sharon Percy, Kema Sikazwe, Steven Richens",,,
I'll See You in My Dreams,,,,"Blythe Danner, Martin Starr, June Squibb, Rhea Perlman, Mary Kay Place, Malin Akerman, Sam Elliott, Aarti Mann, Mark Adair-Rios, Ashley Spillers",,,
I'm in Love with a Church Girl,,,,"Ja Rule, Adrienne Bailon, Stephen Baldwin, Vincent Pastore, Michael Madsen, T-Bone, Martin Kove, Toby Mac",,,
Ice Guardians,,,,"Dave Brown, Brett Hull, Rob Ray, Jarome Iginla, Wendel Clark, Scott Parker, Dave schultz, Jay Baruchel",,,
Iceman,,,,"Donnie Yen, Wang Baoqiang, Shengyi Huang, Yu Kang, Simon Yam, Lam Suet, Singh Hartihan Bitto, Mark Wu",,,
Ideachi Kalpana,,,,"Bhargavi Chirmuley, Mahesh Kothare, Sachin, Ashok Saraf, Nirmiti Sawant",,,
Igor,,,,"John Cusack, Steve Buscemi, Sean Hayes, Molly Shannon, Eddie Izzard, Jennifer Coolidge, Jay Leno",,,
Iliza Shlesinger: War Paint,,,,Iliza Shlesinger,,,
Imagine That,,,,"Eddie Murphy, Thomas Haden Church, Yara Shahidi, Ronny Cox, Stephen Rannazzisi, Nicole Ari Parker, DeRay Davis, Vanessa Williams, Martin Sheen, Lauren Weedman, Timm Sharp, Bobb'e J. Thompson",,,
Immoral Tales,,,,"Lise Danvers, Fabrice Luchini, Charlotte Alexandra, Paloma Picasso, Pascale Christophe, Florence Bellamy, Jacopo Berinizi, Lorenzo Berinizi",,,
In Search of Fellini,,,,"Ksenia Solo, Mary Lynn Rajskub, Maria Bello, Enrico Oetiker, Paolo Bernardini, Beth Riesgraf, David O'Donnell, Nancy Cartwright, Bruno Zanin, Michael Wiseman, Andrea Osvárt",,,
In The Deep,,,,"Mandy Moore, Claire Holt, Matthew Modine, Chris Johnson, Yani Gellman, Santiago Segura",,,
Incir Receli 2,,,,"Halil Sezai Paracıkoğlu, Şafak Pekdemir, Ahmet Uz, Mehmet Selim Akgül, Sinan Çalışkanoğlu, Tuğba Sarıünal",,,
Incoming,,,,"Scott Adkins, Aaron McCusker, Vahldin Prelic, Lukas Loughran, Michelle Lehane, Alaa Seif, Milan Kovacevic, Arkie Reece, Vladimir Alenikov, Dominic Power",,,
Incomplete,,,,"Ritwick Chakraborty, Swastika Mukherjee, Paoli Dam, Bratya Basu, Santu Mukherjee, Dibyendu Bhattacharya, Anindya Bandopadhyay, Poulomi Das, Nigel Akkara, Bhed Sinha",,,
Inconceivable,,,,"Gina Gershon, Faye Dunaway, Nicolas Cage, Nicky Whelan, Natalie Eva Marie, Jonathan Baker, James Van Patten",,,
Incorruptible,,,,,,,
Incredibles 2 (Spanish Version),,,,"Víctor Trujillo, Consuelo Duval, Darío T. Pie, Leyla Rangel, Oliver Díaz Barba, Dulce Guerrero, Eli Fucile, Martin Hernandez",,,
INDIA,,,,"Heeba Shah, Ashwin Shukla, Muskaan, Aldan Shaikh, Ayesha",,,
Indiana Jones and the Kingdom of the Crystal Skull,,,,"Harrison Ford, Cate Blanchett, Karen Allen, Ray Winstone, John Hurt, Jim Broadbent, Igor Jijikine, Shia LaBeouf",,,
Indiana Jones and the Last Crusade,,,,"Harrison Ford, Sean Connery, Denholm Elliott, Alison Doody, John Rhys-Davies, Julian Glover, River Phoenix, Michael Byrne, Kevork Malikyan, Robert Eddison",,,
Indiana Jones and the Raiders of the Lost Ark,,,,"Harrison Ford, Karen Allen, Paul Freeman, Ronald Lacey, John Rhys-Davies, Denholm Elliott, Alfred Molina, Wolf Kahler, Anthony Higgins, Vic Tablian",,,
Indiana Jones and the Temple of Doom,,,,"Harrison Ford, Kate Capshaw, Amrish Puri, Roshan Seth, Philip Stone, Roy Chiao, Jonathan Ke Quan, David Yip, Ric Young, Chua Kah Joo",,,
Indiscretion,,,,"Mira Sorvino, Cary Elwes, Christopher Backus, Katherine McNamara, Lisa Gay Hamilton, Melora Walters, Buck Taylor, Shane Callahan",,,
Inequality for All,,,,Robert Reich,,,
Influx,,,,,,,
Inglourious Basterds,,,,"Brad Pitt, Mélanie Laurent, Christoph Waltz, Eli Roth, Michael Fassbender, Diane Kruger, Daniel Brühl, Til Schweiger, Gedeon Burkhard, Jacky Ido, B.J. Novak, Sylvester Groth, Martin Wuttke",,,
Inkheart,,,,"Brendan Fraser, Paul Bettany, Helen Mirren, Jim Broadbent, Andy Serkis, Sienna Guillory, Eliza Bennett, Rafi Gavron, Lesley Sharp, Jamie Foreman",,,
Insan,,,,"Akshay Kumar, Ajay Devgn, Tusshar Kapoor, Esha Deol, Lara Dutta, Laila, Rahul Dev, Koena Mitra, Archana Puran Singh, Sharat Saxena",,,
