title,,,,cast,,,
Sat Shri Akaal England,,,,"Ammy Virk, Monica Gill, Karamjit Anmol, Sardar Sohi, Jarnail Singh, Satwant Kaur, Harby Sangha, Baljinder Darapuri",,,
Thaandavam,,,,"Vikram, Jagapathi Babu, Anushka Shetty, Amy Jackson, Lakshmi Rai, Santhanam, Nasser, Saranya Ponvannan",,,
The Birth Reborn,,,,,,,
Theeya Velai Seyyanum Kumaru,,,,"Siddarth, Santhanam, Hansika Motwani, Ganesh Venkatraman, RJ Balaji, Bosskey, Manobala, Chitra Lakshmanan",,,
Tiger,,,,"Sippy Gill, Ihana Dhillon, Yograj Singh, Yashpal Sharma, Deedar GIll, Rahul Jugraj, Virender Nath Lubana, Aneeta",,,
Udaan,,,,"Rajat Barmecha, Ronit Roy, Ram Kapoor, Aayan Boradia, Manjot Singh, Anand Tiwari, Raja Hudda, Shaunak Sengupta, Varun Khettry, Akshay Sachdev",,,
Vettai,,,,"Arya, Madhavan, Sameera Reddy, Amala Paul, Nasser, Ashutosh Rana, Sreejith Ravi, Muthukumar",,,
Wake Up Sid,,,,"Ranbir Kapoor, Konkona Sen Sharma, Shruti Bapna, Krutika Bolaki, Namit Das, Munir Kabani, Mohsin Ali Khan, Anupam Kher, Rahul Khanna, Kainaz Motivala",,,
We Are Family,,,,"Kajol, Kareena Kapoor, Arjun Rampal, Nominath Ginsberg, Iravati Harshe, Aachal Munjal, Diya Sonecha",,,
What the Jatt!!,,,,"Harish Verma, Isha Rikhi, Vipul Roy, Binnu Dhillon, Poonam Rajput, B.N. Sharma, Satti Sembi",,,
Zindagi Kitni Haseen Hay,,,,"Feroze Khan, Sajal Ali, Jibrayl Ahmed Rajput, Alyy Khan, Shafqat Cheema, Nayyar Ejaz, Rashid Farooqi",,,
Big Miracle,,,,"Drew Barrymore, John Krasinski, Kristen Bell, Dermot Mulroney, Tim Blake Nelson, Vinessa Shaw, Ted Danson, Stephen Root, Rob Riggle, Michael Gaston",,,
Paradise Lost,,,,"Júlio Andrade, Lee Taylor, Hermila Guedes, Julia Konrad, Erasmo Carlos, Marjorie Estiano, Seu Jorge, Jaloo, Felipe Abib, Humberto Carrão, Malu Galli",,,
Animal World,,,,"Li Yi Feng, Zhou Dongyu, Michael Douglas, Bingkun Cao, Ge Wang, Keanu Chi, Zhang Jungyi, Yijuan Li, Su Ke",,,
Hold the Dark,,,,"Jeffrey Wright, Alexander Skarsgård, James Badge Dale, Riley Keough, Julian Black Antelope, Tantoo Cardinal, Macon Blair, Jonathan Whitesell, Peter McRobbie",,,
Lessons from a School Shooting: Notes from Dunblane,,,,,,,
The 3rd Eye,,,,"Jessica Mila, Denny Sumargo, Citra Prima, Bianca Hello, Epy Kusnandar, Anita Hara, Derry Drajat, Voke Victoria, Shofia Shireen, Afdhal Yusman",,,
Two Catalonias,,,,,,,
In Darkness,,,,"Natalie Dormer, Ed Skrein, Emily Ratajkowski, Neil Maskell, Jan Bijvoet, James Cosmo, Joely Richardson",,,
Quincy,,,,Quincy Jones,,,
Rafinha Bastos: Ultimatum,,,,Rafinha Bastos,,,
The Angel,,,,"Marwan Kenzari, Hannah Ware, Toby Kebbell, Waleed Zuaiter, Maisa Abd Elhadi, Sasson Gabai, Mickey Leon, Ori Pfeffer, Slimane Dazi",,,
The Land of Steady Habits,,,,"Ben Mendelsohn, Edie Falco, Connie Britton, Thomas Mann, Bill Camp, Elizabeth Marvel, Charlie Tahan, Michael Gaston, Josh Pais",,,
Reversing Roe,,,,"Ricki Stern, Annie Sundberg",,,
On My Skin,,,,"Alessandro Borghi, Jasmine Trinca, Milvia Marigliano, Max Tortora",,,
The Resistance Banker,,,,"Barry Atsma, Jacob Derwig, Pierre Bokma, Jaap Spijkers, Raymond Thiry, Fockeline Ouwerkerk, Matteo van der Grijn, Jochum ten Haaf, Peter Jordan, Götz Schubert",,,
City of Joy,,,,,,,
Next Gen,,,,"John Krasinski, Charlyne Yi, Jason Sudeikis, Michael Peña, David Cross, Constance Wu",,,
Sierra Burgess Is A Loser,,,,"Shannon Purser, Kristine Froseth, RJ Cyler, Noah Centineo, Loretta Devine, Giorgia Whigham, Alice Lee, Lea Thompson, Alan Ruck, Mary Pat Gleason, Chrissy Metz",,,
The Most Assassinated Woman in the World,,,,"Anna Mouglalis, Niels Schneider, André Wilms, Michel Fau, Sissi Duparc, Jean-Michel Balthazar, Julie Recoing, Eric Godon, Maya Coline, Constance Dollé",,,
PK,,,,"Aamir Khan, Anuskha Sharma, Sanjay Dutt, Saurabh Shukla, Parikshat Sahni, Sushant Singh Rajput, Boman Irani, Rukhsar",,,
The Debt Collector,,,,"Scott Adkins, Louis Mandylor, Vladimir Kulich, Michael Paré, Rachel Brann, Selina Lo, Tony Todd",,,
Carbon,,,,"Benoît Magimel, Gringe, Idir Chender, Laura Smet, Michaël Youn, Dani, Patrick Catalifo, Gérard Depardieu",,,
Garbage,,,,"Tanmay Dhanania, Trimala Adhikari, Satarupa Das, Satchit Puranik, Gitanjali Dang, Shruti Viswan, Nikhil Chopra, Krish Moitra",,,
​​Kuch Bheege Alfaaz,,,,"Geetanjali Thapa, Zain Khan Durrani, Shray Rai Tiwari, Mona Ambegaonkar, Chandreyee Ghosh, Barun Chanda, Saheb Bhattacharjee, Shefali Chauhan",,,
Love and Shukla,,,,"Saharsh Kumar Shukla, Taneea Rajawat, Hima Singh, Aparna Upadhyay, Loknath Tiwari, Sambhaji Sasane",,,
Once Again,,,,"Shefali Shah, Neeraj Kabi, Rasika Dugal, Bidita Bag, Priyanshu Painyuli, Bhagwan Tiwari",,,
Sparring,,,,"Mathieu Kassovitz, Olivia Merilahti, Souleymane M'Baye, Billie Blain, Malik Bine, Zakariya Gouram, Jolente De Keersmaeker, Lyes Salem, Ali Labidi, David Saracino",,,
The Laws of Thermodynamics,,,,"Vito Sanz, Berta Vázquez, Chino Darín, Vicky Luengo, Andrea Ros, Irene Escolar, Josep Maria Pou, Daniel Sánchez Arévalo",,,
Naam Shabana,,,,"Tapsee Pannu, Akshay Kumar, Manoj Bajpayee, Prithviraj Sukumaran, Danny Denzongpa, Anupam Kher, Zakir Hussain, Virendra Saxenda",,,
Qarib Qarib Singlle,,,,"Irrfan Khan, Parvathy, Neha Dhupia, Pushtii Shakti, Luke Kenny, Siddharth Menon, Bajrangbali Singh, Brijendra Kala",,,
Spyder,,,,"Mahesh Babu, Rakul Preet Singh, S.J. Surya, Bharath Srinivasan, Priyadarshi Pullikonda, RJ Balaji",,,
Maria Bamford: The Special Special Special,,,,"Maria Bamford, Wayne Federman, Jackie Kashian",,,
Bert Kreischer: Secret Time,,,,Bert Kreischer,,,
One Last Shot,,,,"Robb Wells, John Paul Tremblay, John Dunsworth",,,
The After Party,,,,"Kyle Harvey, Harrison Holzer, Teyana Taylor, Shelley Hennig, Wiz Khalifa, Blair Underwood, Jordan Rock, Amin Joseph, Andy Buckley, Jamie Choi",,,
Bareilly Ki Barfi,,,,"Ayushmann Khurrana, Kriti Sanon, Rajkummar Rao, Pankaj Tripathi, Seema Pahwa, Rohit Chaudhury, Swati Semwal",,,
Mersal,,,,"Joseph Vijay, S.J. Surya, Kajal Aggarwal, Samantha Ruth Prabhu, Nithya Menon, Vadivelu, Sathyaraj",,,
Mom,,,,"Sridevi, Akshaye Khanna, Sajal Ali, Nawazuddin Siddiqui, Adnan Siddiqui, Pitobash, Abhimanyu Singh, Vikas Verma",,,
Pad Man,,,,"Akshay Kumar, Sonam Kapoor, Radhika Apte, Jyoti Subhash, Urmila Mahanta, Suneel Sinha, Sanjay Singh, Rakesh Chaturvedi Om",,,
Toilet: Ek Prem Katha,,,,"Akshay Kumar, Bhumi Pednekar, Divyendu Sharma, Atul Srivastava, Anupam Kher, Ayesha Raza Mishra, Mukesh S Bhatt, Shubha Khote, Sudhir Pandey",,,
Party Monster: Scratching the Surface,,,,"Ellie Kemper, Jane Krakowski, Tituss Burgess, Carol Kane, Jon Hamm, Bobby Moynihan, Lauren Adams, Sara Chase, Sol Miranda, Derek Klena, Aidy Bryant",,,
The Motive,,,,"Javier Gutiérrez, María León, Adelfa Calvo, Adriana Paz, Tenoch Huerta, Rafael Téllez, Antonio de la Torre",,,
To All the Boys I’ve Loved Before,,,,"Lana Condor, Noah Centineo, Janel Parrish, Anna Cathcart, Andrew Bachelor, Trezzo Mahoro, Madaleine Arthur, Israel Broussard, Emilija Baranac, John Corbett",,,
Yoo Byung Jae: Discomfort Zone,,,,Yoo Byung Jae,,,
Bhavesh Joshi Superhero,,,,"Harshvardhan Kapoor, Priyanshu Painyuli, Ashish Verma, Shreiya Sabharwal, Pratap Phad, Chinmayee Mandlekar, Nishikant Kamat, Hrishikesh Joshi",,,
For Here or to Go?,,,,"Ali Fazal, Melanie Chandra, Rajit Kapoor, Amitosh Nagpal, Omi Vaidya, Samrat Chakrabarti, Keith Stevenson",,,
The Guernsey Literary and Potato Peel Pie Society,,,,"Lily James, Michiel Huisman, Penelope Wilton, Tom Courtenay, Jessica Brown Findlay, Katherine Parkinson, Matthew Goode",,,
The Package,,,,"Daniel Doheny, Geraldine Viswanathan, Luke Spencer Roberts, Eduardo Franco, Sadie Calvano",,,
Zion,,,,Zion Clark,,,
Perdida,,,,"Luisana Lopilato, Amaia Salamanca, Rafael Spregelburd, Nicolás Furtado, Oriana Sabatini, Pedro Casablanc, Arancha Martí, Carlos Alcántara, María Onetto, Sara Sálamo",,,
2 States,,,,"Alia Bhatt, Arjun Kapoor, Ronit Roy, Amrita Singh, Revathy, Aru Krishansh Verma",,,
Baaghi,,,,"Tiger Shroff, Shraddha Kapoor, Sudheer Babu, Paras Arora, Sunil Grover, Sourav Chakraborty, Shaurya Bhardawaj",,,
Brij Mohan Amar Rahe,,,,"Arjun Mathur, Nidhi Singh, Manav Vij, Sheetal Thakur, Sunny Hinduja, Yogendra Tikku, Vijayant Kohli",,,
Flavors of Youth: International Version,,,,"Taito Ban, Mariya Ise, Minako Kotobuki, Haruka Shiraishi, Hiroki Yasumoto, Takeo Otsuka, Ikumi Hasegawa, Takayuki Nakatsukasa",,,
Like Father,,,,"Kristen Bell, Kelsey Grammer, Seth Rogen, Paul W. Downs, Zach Appelman, Leonard Ouzts, Blaire Brooks, Anthony Laciura, Mary Looram, Brett Gelman",,,
7 Khoon Maaf,,,,"Priyanka Chopra, Neil Nitin Mukesh, John Abraham, Irrfan Khan, Aleksandr Dyachenko, Annu Kapoor, Naseeruddin Shah, Vivaan Shah, Usha Uthup, Konkona Sen Sharma",,,
Chillar Party,,,,"Irfan Khan, Raju, Sanath Menon, Rohan Grover, Naman Jain, Aarav Khanna, Vishesh Tiwari, Chinmai Chandranshuh, Vedant Desai, Shriya Sharma, Divji Handa",,,
Fashion,,,,"Priyanka Chopra, Kangana Ranaut, Mugdha Godse, Arbaaz Khan, Arjan Bajwa, Raj Babbar, Kiran Juneja, Samir Soni",,,
Fitoor,,,,"Aditya Roy Kapoor, Katrina Kaif, Tabu, Rahul Bhatt, Lara Dutta, Akshay Oberoi, Aditi Rao Hydari, Ajay Devgn",,,
Fiza,,,,"Karisma Kapoor, Jaya Bhaduri, Hrithik Roshan, Neha, Asha Sachdev, Bikram Saluja, Isha Koppikar, Johny Lever, Sushmita Sen, Manoj Bajpayee",,,
Guzaarish,,,,"Hrithik Roshan, Aishwarya Rai Bachchan, Shernaz Patel, Aditya Roy Kapoor, Nafisa Ali, Monikangana Dutta, Suhel Seth, Rajit Kapoor, Ash Chandler, Vijay Crishna",,,
Haider,,,,"Shahid Kapoor, Tabu, Shraddha Kapoor, Kay Kay Menon, Irrfan Khan, Narendra Jha",,,
Highway,,,,"Randeep Hooda, Alia Bhatt, Durgesh Kumar, Pradeep Nagar",,,
I Hate Luv Storys,,,,"Imran Khan, Sonam Kapoor, Sammir Dattani, Samir Soni, Kavin Dave, Bruna Abdullah",,,
Joker,,,,"Akshay Kumar, Sonakshi Sinha, Shreyas Talpade, Minissha Lamba, Pitobash, Darshan Jariwala, Alexx O'Nell, Asrani, Sanjay Mishra, Vrijesh Hirjee",,,
Main aurr Mrs. Khanna,,,,"Salman Khan, Kareena Kapoor, Sohail Khan, Preity Zinta, Bappi Lahiri, Yash Tonk, Nauheed Cyrusi, Mahek Chahal",,,
Mohenjo Daro,,,,"Hrithik Roshan, Sonakshi Sinha, Pooja Hegde, Kabir Bedi, Arunoday Singh, Kishori Shahane, Narendra Jha, Nitish Bharadwaj",,,
Raajneeti,,,,"Ajay Devgn, Nana Patekar, Ranbir Kapoor, Katrina Kaif, Arjun Rampal, Manoj Bajpayee, Sarah Thompson, Naseeruddin Shah",,,
Rang De Basanti,,,,"Aamir Khan, Siddharth, Atul Kulkarni, Sharman Joshi, Kunal Kapoor, Alice Patten, Soha Ali Khan, Waheeda Rehman, Kiron Kher, Om Puri, Anupam Kher, Madhavan",,,
Rowdy Rathore,,,,"Akshay Kumar, Sonakshi Sinha, Nasser, Yashpal Sharma, Paresh Ganatra, Gurdip Kohli, Mushtaq Khan, Amit Kumar Tiwari",,,
Tamasha,,,,"Ranbir Kapoor, Deepika Padukone, Piyush Mishra, Javed Sheikh, Nikhil Bhagat, Faraaz Servaia",,,
Tere Naal Love Ho Gaya,,,,"Riteish Deshmukh, Genelia D'Souza, Tinnu Anand, Om Puri, Smita Jaykar, Chitrashi Rawat, Navin Prabhakar, Kartar Cheema",,,
Thank You,,,,"Akshay Kumar, Bobby Deol, Sonam Kapoor, Irrfan Khan, Sunil Shetty, Rimi Sen, Celina Jaitly",,,
The Blue Umbrella,,,,"Pankaj Kapur, Shreya Sharma, Dolly Ahluwalia, Deepak Dobriyal, Rahul Kumar, Paramjit Singh Kakran, Piu Dutt, Samrat Mukherjee",,,
Being Napoleon,,,,"Mark Schneider, Frank Samson",,,
Invisible,,,,"Mora Arenillas, Mara Bestelli, Diego Cremonesi",,,
Da Kath & Kim Code,,,,"Jane Turner, Gina Riley, Glenn Robbins, Peter Rowsthorn, Magda Szubanski",,,
Kath & Kimderella,,,,"Jane Turner, Gina Riley, Magda Szubanski, Glenn Robbins, Peter Rowsthorn, Rob Sitch, Richard E. Grant, Barry Humphries, Erin Mullally, Jessica De Gouw",,,
The Mansion,,,,"Nathalie Odzierejko, Marc Jarousseau, Ludovik Day, Yvick Letexier, Jérôme Niel, Vincent Tirel, Vanessa Guide, Delphine Baril, Baptiste Lorber, Lila Lacombe",,,
Coco y Raulito: Carrusel de ternura,,,,"Coco Celis, Raúl Meneses",,,
Extinction,,,,"Michael Peña, Lizzy Caplan, Israel Broussard, Mike Colter, Emma Booth, Lex Shrapnel, Erica Tremblay, Lilly Aspell",,,
The Bleeding Edge,,,,,,,
Parmanu: The Story of Pokhran,,,,"John Abraham, Boman Irani, Diana Penty, Anuja Sathe, Yogendra Tikku, Aditya Hitkari, Vikas Kumar, Ajay Shankar, Darshan Pandya, Mark Benington",,,
Iliza Shlesinger: Elder Millennial,,,,Iliza Shlesinger,,,
The Warning,,,,"Raúl Arévalo, Aura Garrido, Hugo Arbues, Belén Cuesta, Antonio Dechent, Aitor Luna, Sergio Mur",,,
Duck Duck Goose,,,,"Jim Gaffigan, Zendaya, Lance Lim, Greg Proops, Reggie Watts, Carl Reiner, Jennifer Grey, Stephen Fry, Diedrich Bader, Natasha Leggero, Craig Ferguson, Rick Overton",,,
Father of the Year,,,,"David Spade, Nat Faxon, Joey Bragg, Matt Shively, Bridgit Mendler, Jackie Sandler, Mary Gillis",,,
Nothing to Lose,,,,"Petrônio Gontijo, Day Mesquita, Beth Goulart, Dalton Vigh, Eduardo Galvão, André Gonçalves, Marcello Airoldi",,,
El club de los buenos infieles,,,,"Raúl Fernández, Fele Martínez, Juanma Cifuentes, Hovik Keuchkerian, Albert Ribalta, Jordi Vilches, Adrián Lastra, Raquel Salvador, Marta Brucart, Betsy Turnez",,,
Camarón: The Film,,,,Juan Diego,,,
GODZILLA City on the Edge of Battle,,,,"Mamoru Miyano, Takahiro Sakurai, Kana Hanazawa, Tomokazu Sugita, Yuki Kaji, Junichi Suwabe, Reina Ueda, Ari Ozawa, Daisuke Ono, Kenta Miyake, Kenyu Horiuchi, Kazuya Nakai, Kazuhiro Yamaji",,,
Going for Gold,,,,"Kelli Berglund, Emily Morris, Terry Rogers, Jess Kuss, Jo Stone, Elysia Markou, Daisy Anderson, Ruth Natalie Fallon, Henry Turczynowicz, Martha Lott",,,
How It Ends,,,,"Theo James, Forest Whitaker, Kat Graham, Nicole Ari Parker, Mark O'Brien, Grace Dove",,,
Jim Jefferies: This Is Me Now,,,,Jim Jefferies,,,
Romina,,,,"Francisca Lozano, Oliver Nava, Arantza Ruiz, Claudia Zepeda, Walter Bercht, Roberto Beck, Victor Bonilla, Eduardo Negrete",,,
Luciano Mellera: Infantiloide,,,,Luciano Mellera,,,
The Legacy of a Whitetail Deer Hunter,,,,"Josh Brolin, Danny McBride, Montana Jordan, Scoot McNairy, Carrie Coon",,,
The Skin of the Wolf,,,,"Mario Casas, Irene Escolar, Ruth Díaz",,,
White Fang,,,,"Nick Offerman, Rashida Jones, Paul Giamatti, Eddie Spears, David Boat, Sean Kenin, Raquel Antonia, Daniel Hagen, Stephen Kramer Glickman, William Calvert, Jason Grasl, Armando Riesco",,,
Sommore: Chandelier Status,,,,Sommore,,,
Felipe Esparza: They're Not Going to Laugh at You,,,,Felipe Esparza,,,
Joan Rivers: Don't Start with Me,,,,Joan Rivers,,,
Katt Williams: Kattpacalypse,,,,Katt Williams,,,
King of Peking,,,,"Zhao Jun, Wang Naixun, Han Qing, Si Chao, Geng Bowen, Yi Long",,,
Anthony Kaun Hai?,,,,"Sanjay Dutt, Arshad Warsi, Minissha Lamba, Raghuvir Yadav, Anusha Dhandekar, Gulshan Grover, Ravi Baswani",,,
Bo Burnham: what.,,,,Bo Burnham,,,
Chalte Chalte,,,,"Shah Rukh Khan, Rani Mukerji, Jas Arora, Satish Shah, Rajiv Verma, Lillete Dubey, Jayshree T., Johny Lever",,,
Deewana Main Deewana,,,,"Govinda, Priyanka Chopra, Kader Khan, Prem Chopra, Shakti Kapoor, Sharat Saxena, Himani Shivpuri, Johnny Lever",,,
Duck Butter,,,,"Alia Shawkat, Laia Costa, Mae Whitman, Hong Chau, Kate Berlant, Lindsay Burdge, Kumail Nanjiani, Mark Duplass, Jay Duplass, Jenny O'Hara",,,
I Am Kalam,,,,"Gulshan Grover, Harsh Mayar, Pitobash, Hussan Saad, Beatrice Ordeix, Sanjay Chauhan",,,
My Birthday Song,,,,"Sanjay Suri, Nora Fatehi, Zenia Starr, Suparna Krishna, Elena Kazan",,,
Namastey London,,,,"Akshay Kumar, Katrina Kaif, Rishi Kapoor, Upen Patel, Javed Sheikh, Nina Wadia, Clive Standen, Tiffany Mulheron",,,
Soul Robbers,,,,"Sofía Sisniega, Natasha Dupeyron, Ana Sofía Durán, Javier Escobar, Luis Gatica, Juan Ángel Esparza, Jorge Luis Moreno, Arnulfo Reyes Sanchez, Tizoc Arroyo, José Enot, Ricardo Dalmacci, Harding Junior, Claudine Sosa, Pablo Valentín",,,
Tum Milo Toh Sahi,,,,"Nana Patekar, Dimple Kapadia, Sunil Shetty, Vidya Malvade, Rehan Khan, Anjana Sukhani, Mohnish Bahl, Vrajesh Hirjee",,,
What We Started,,,,,,,
Zoo,,,,"Shashank Arora, Shweta Tripathi, Rahul Kumar, Gopal K. Singh, Yogesh Kurme, Prince Daniel",,,
Bill Burr: You People Are All the Same,,,,Bill Burr,,,
The Maus,,,,"Alma Terzic, August Wittgenstein, Aleksandar Seksan, Sanin Milavic, Diana Fernández Pérez, Ella Jazz",,,
Calibre,,,,"Jack Lowden, Martin McCann, Tony Curran, Ian Pirie, Cameron Jack",,,
Jani Dueñas: Grandes fracasos de ayer y hoy,,,,Jani Dueñas,,,
Penalty Kick,,,,"Adrián Uribe, Julieth Restrepo, Carlos Manuel Vesga, José Sefami, Mary Paz Mata, Alicia Sandoval, Teresa Monroy, Eduardo Ibarrola",,,
Recovery Boys,,,,,,,
TAU,,,,"Maika Monroe, Ed Skrein, Gary Oldman",,,
W. Kamau Bell: Private School Negro,,,,W. Kamau Bell,,,
Expelled from Paradise,,,,"Rie Kugimiya, Wendee Lee, Shinichiro Miki, Steve Blum, Hiroshi Kamiya, Johnny Yong Bosch",,,
"To Each, Her Own",,,,"Sarah Stern, Jean-Christophe Folly, Julia Piaton, Arié Elmaleh, Clémentine Poidatz, Stéphane Debac, Richard Berry, Catherine Jacob",,,
Brain on Fire,,,,"Chloë Grace Moretz, Thomas Mann, Richard Armitage, Jenny Slate, Carrie-Anne Moss, Tyler Perry, Alex Zahara",,,
Derren Brown: Miracle,,,,Derren Brown,,,
Us and Them,,,,"Jing Boran, Zhou Dongyu, Zhuangzhuang Tian, Qu Zheming, Zhang Zixian",,,
Hannah Gadsby: Nanette,,,,Hannah Gadsby,,,
Lust Stories,,,,"Vicky Kaushal, Bhumi Pednekar, Radhika Apte, Neha Dhupia, Manisha Koirala, Akash Thosar, Randeep Jha, Neil Bhoopalam, Jaideep Ahlawat, Sanjay Kapoor, Kiara Advani",,,
Maktub,,,,"Guy Amir, Hanan Savyon, Itzik Cohen, Igal Naor",,,
Pacificum: Return to the Ocean,,,,,,,
Set It Up,,,,"Zoey Deutch, Glen Powell, Lucy Liu, Taye Diggs, Meredith Hagner, Pete Davidson, Tituss Burgess",,,
Sunday's Illness,,,,"Bárbara Lennie, Susi Sánchez, Miguel Ángel Solá, Richard Bohringer",,,
The last hour,,,,"Pietro Sibille, Nidia Bermejo, Toño Vega, Tommy Párraga, Fausto Molina, Katerina D'Onofrio, Haysen Percovich, Emilram Cossío, Sandro Calderón, Tony Dulzaidez",,,
Alex Strangelove,,,,"Daniel Doheny, Madeline Weinstein, Antonio Marziale, Daniel Zolghadri, Annie Q., Nik Dodani, Fred Hechinger, Kathryn Erbe, Isabella Amara, Sophie Faulkenberry",,,
Ali's Wedding,,,,"Osamah Sami, Don Hany, Helana Sawires, Frances Duca, Majid Shokor, Rodney Afif, Ghazi Alkinani, Ryan Corr",,,
Franco Escamilla: Por la anécdota,,,,Franco Escamilla,,,
B.A. Pass 2,,,,"Kritika Sachdeva, Sasho, Sanghmitra Hitaishi, Indraneil Sengupta, Saurabh Dubey, Shubhangi Latkar, Sukhbir Kaur Lamba, Arav Chowdharry",,,
Bad Genius,,,,"Chutimon Chuengcharoensukying, Chanon Santinatornkul, Teeradon Supapunpinyo, Eisaya Hosuwan, Thaneth Warakulnukroh, Sarinrat Thomas, Ego Mikitas, Pasin Kuansataporn, Sahajak Boonthanakit, Kanjana Vinaipanid",,,
Outside In,,,,"Jay Duplass, Edie Falco, Kaitlyn Dever, Ben Schwartz, Louis Hobson, Alycia Delmore, Pamela Reed, Matt Malloy, Aaron Blakely",,,
Pedal the World,,,,Felix Starck,,,
Sara's Notebook,,,,"Belén Rueda, Marian Álvarez, Iván Mendes, Manolo Cardona, Nick Devlin, Florin Opritescu",,,
Fernando Sanjiao: Hombre,,,,Fernando Sanjiao,,,
Ibiza,,,,"Gillian Jacobs, Vanessa Bayer, Phoebe Robinson, Richard Madden, Michaela Watkins, Félix Gómez",,,
Steve Martin and Martin Short: An Evening You Will Forget for the Rest of Your Life,,,,"Steve Martin, Martin Short",,,
Tig Notaro Happy To Be Here,,,,Tig Notaro,,,
Catching Feelings,,,,"Kagiso Lediga, Pearl Thusi, Akin Omotoso, Andrew Buckland",,,
Katt Williams: American Hustle (The Movie),,,,"Katt Williams, Da Brat, Snoop Dogg, Tamala Jones, Jeremy Piven, Ludacris, Melanie Comarcho, Red Grant, Alphonso Mcauley, Damaine Radcliff, Taran Killam",,,
Food on the Go,,,,,,,
Aiyaary,,,,"Sidharth Malhotra, Manoj Bajpayee, Rakul Preet Singh, Pooja Chopra, Adil Hussain, Kumud Mishra, Naseeruddin Shah, Anupam Kher, Vikram Gokhale, Juhi Babbar",,,
Lupin the 3rd: The Castle of Cagliostro: Special Edition,,,,"Yasuo Yamada, Kiyoshi Kobayashi, Eiko Masuyama, Makio Inoue, Goro Naya, Sumi Shimamoto, Taro Ishida, Kohei Miyauchi, Ichiro Nagai",,,
Ali Wong: Hard Knock Wife,,,,Ali Wong,,,
Spivak,,,,"Michael Bacall, Maggie Lawson, Elden Henson, Robert Kazinsky, Mark Webber, Chloe Wepper",,,
Carlos Ballarta: Furia Ñera,,,,Carlos Ballarta,,,
The Kissing Booth,,,,"Joey King, Joel Courtney, Jacob Elordi, Molly Ringwald",,,
Hari Kondabolu: Warn Your Relatives,,,,Hari Kondabolu,,,
My Fuhrer,,,,"Helge Schneider, Ulrich Mühe, Sylvester Groth, Adriana Altaras, Stefan Kurt, Ulrich Noethen, Lambert Hamel, Udo Kroschwald, Torsten Michaelis, Axel Werner",,,
Family Blood,,,,"James Ransone, Vinessa Shaw, Ajiona Alexus, Colin Ford",,,
Pup Star: World Tour,,,,"Jed Ress, Makenzie Moss, Denisse Ojeda, Reggie De Leon, David DeLuise, Kaitlyn Maher, Jorge Diaz, George Newbern, Diedrich Bader, Mackenzie Sol",,,
Anon,,,,"Clive Owen, Amanda Seyfried, Colm Feore, Sonya Walger, Mark O'Brien, Joe Pingue, Iddo Goldberg, Sebastian Pigott, Rachel Roberts, Ethan Tavares",,,
Dany Boon: Des Hauts De France,,,,Dany Boon,,,
End Game,,,,,,,
Forgive Us Our Debts,,,,"Marco Giallini, Claudio Santamaria, Jerzy Stuhr, Flonja Kodheli",,,
Lo más sencillo es complicarlo todo,,,,"Danna Paola, Marjorie De Sousa, Alosian Vivancos, Daniela Wong, Lalo Brito, Eduardo Tanús, Paulina Matos, Fernando Sarfati, Lorena San Martín, Consuelo Vega",,,
Manhunt,,,,"Zhang Hanyu, Masaharu Fukuyama, Qi Wei, Ji-won Ha, Jun Kunimura, Angeles Woo, Nanami Sakuraba",,,
Thi Mai,,,,"Carmen Machi, Adriana Ozores, Aitana Sánchez-Gijón, Dani Rovira, Eric Nguyen, Pedro Casablanc, José Troncoso, José Burgos, Ana López, Pedro Miguel Martínez, Nguyen Ngan Ha",,,
Si saben cómo me pongo ¿pá qué me invitan?,,,,"Ricardo Quevedo, Iván Marín, Freddy Beltrán, Nelson Polanía, Fabiola Posada, Liss Pereira, Jessica Sanjuan, Lina Cardona",,,
Jailbreak,,,,"Jean-Paul Ly, Dara Our, Tharoth Sam, Dara Phang, Celine Tran, Savin Phillip, Sok Visal",,,
Ajji,,,,"Sushama Deshpande, Abhishek Banerjee, Smita Tambe, Sharvani Suryavanshi, Vikas Kumar, Sadiya Siddiqui, Sudhir Pandey, Manuj Sharma",,,
CIA: Comrade in America,,,,"Dulquer Salmaan, Karthika Muraleedharan, Siddique, Soubin Shahir, Dileesh Pothan, John Vijay, Chandini Sreedharan, Jinu Joseph, Sujith Shankar, Alencier Ley Lopez",,,
Coffee for All,,,,,,,
Darc,,,,"Tony Schiena, Armand Assante, Kippei Shiina, Sho Ikushima, Vienna Hehir, Tetsu Watanabe, Grand Master John U. Kim, Dawn Olivieri",,,
Despido Procedente,,,,"Imanol Arias, Darío Grandinetti, Hugo Silva, Luis Luque, Miguel Ángel Solá, Tomás Pozzi, Valeria Alonso",,,
John Mulaney: Kid Gorgeous at Radio City,,,,John Mulaney,,,
My Perfect Romance,,,,"Kimberly-Sue Murray, Christopher Russell, Lauren Holly, Jodie Sweetin, Morgan Fairchild",,,
Pocoyo & Cars,,,,"Stephen Fry, Alex Marty",,,
Pocoyo & The Space Circus,,,,"Stephen Fry, Carys Doyle",,,
Pocoyo Carnival,,,,"Stephen Fry, Alex Marty",,,
Pocoyo Halloween: Space Halloween,,,,"Stephen Fry, Montana Smedley",,,
Pocoyo Halloween: Spooky Movies,,,,"Stephen Fry, Montana Smedley",,,
Pocoyo Special Sports,,,,,,,
Sometimes,,,,"Prakash Raj, Shreya Reddy, Ashok Selvan",,,
The Clapper,,,,"Ed Helms, Amanda Seyfried, Tracy Morgan, Brenda Vaccaro, P.J. Byrne, Leah Remini, Mickey Gooch Jr., Adam Levine, Russell Peters, Alan Thicke",,,
Toc Toc,,,,"Paco León, Alexandra Jiménez, Rossy de Palma, Nuria Herrero, Adrián Lastra, Oscar Martínez, Inma Cuevas, Ana Rujas, Carolina Lapausa",,,
Running Shaadi,,,,"Amit Sadh, Tapsee Pannu, Arsh Bajwa, Brijendra Kala, Mahavir Bhullar, Pankaj Jha, Neeta Mohindra",,,
The Price of Success,,,,"Tahar Rahim, Maïwenn Le Besco, Roschdy Zem, Grégoire Colin, Sultan, Ali Marhyar, Camille Lellouche, Saïda Bekkouche, Meriem Serbah, Salma Lahmer",,,
Candy Jar,,,,"Christina Hendricks, Helen Hunt, Uzo Aduba, Sami Gayle, Jacob Latimore",,,
Holy Goalie,,,,"Karra Elejalde, Alain Hernández, Juan Manuel Montilla, Joel Bosqued, Macarena García, Tito Valverde, Paco Rueda, Guillermo Furiase, Txema Blasco, Paco Sagarzazu",,,
The Rachel Divide,,,,,,,
The Week Of,,,,"Adam Sandler, Chris Rock, Steve Buscemi, Rachel Dratch, Allison Strong, Roland Buck III, Katie Hartman, Chloe Himmelman, Jake Lippmann, Jim Barone, June Gable",,,
Enissa Amani: Ehrenwort,,,,Enissa Amani,,,
Bill Nye: Science Guy,,,,"Bill Nye, Neil deGrasse Tyson, Eugenie Scott, Francis Collins, Ann Druyan",,,
Fishtronaut: The Movie,,,,"Fábio Lucindo, Celso Alves, Fernanda Bullara",,,
Psychokinesis,,,,"Ryu Seung-ryong, Shim Eun-kyung, Jung-min Park, Min-jae Kim, Yu-mi Jung",,,
Kevin James: Never Don't Give Up,,,,Kevin James,,,
Dude,,,,"Lucy Hale, Kathryn Prescott, Alexandra Shipp, Awkwafina, Alex Wolff, Brooke Smith, Jerry MacKinnon, Ronen Rubenstein, Satya Bhabha, Sydney Lucas",,,
Kodachrome,,,,"Ed Harris, Jason Sudeikis, Elizabeth Olsen",,,
Mercury 13,,,,,,,
All The Reasons To Forget,,,,"Johnny Massaro, Bianca Comparato, Regina Braga, Maria Laura Nogueira, Victor Mendes, Thiago Amaral, Rafael Primot, Eduardo Mossri, Rita Batata, Larissa Ferrara",,,
Beyond Skyline,,,,"Frank Grillo, Bojana Novakovic, Jonny Weston, Callan Mulvey, Antonio Fargas, Yayan Ruhian, Pamelyn Chee, Jacob Vargas, Iko Uwais",,,
Come Sunday,,,,"Chiwetel Ejiofor, Martin Sheen, Danny Glover, Jason Segel, Condola Rashad, Lakeith Stanfield, Stacey Sargeant, Vondie Curtis-Hall",,,
I Am not an Easy Man,,,,"Vincent Elbaz, Marie-Sophie Ferdane, Pierre Benezit, Blanche Gardin, Celine Menville",,,
Pickpockets,,,,"Carlos Bardem, Natalia Reyes, Emiliano Pernia, Duban Prado, Marcela Mar",,,
Greg Davies: You Magnificent Beast,,,,Greg Davies,,,
6 Balloons,,,,"Abbi Jacobson, Dave Franco, Jane Kaczmarek, Tim Matheson, Charlotte Carel, Madeline Carel, Maya Erskine, Dawan Owens, Jen Tullock",,,
Amateur,,,,"Michael Rainey Jr., Josh Charles, Brian White, Sharon Leal, Ashlee Brian, Corey Parker Robinson",,,
Orbiter 9,,,,"Clara Lago, Alex Gonzalez, Andrés Parra, Belén Rueda",,,
"Ram Dass, Going Home",,,,Ram Dass,,,
